,Title,Relase,Audience Rating,Runtime,Genre,IMDB Rating,Votes,Box Office Earnings,Director,Actors,Description
230,Midnight in Paris,-2011,PG-13,94 min,"Comedy, Fantasy, Romance            ",7.7,"3,77,873","3,77,873",Woody Allen,"['Owen Wilson', 'Rachel McAdams', 'Kathy Bates', 'Kurt Fuller']","While on a trip to Paris with his fiancée's family, a nostalgic screenwriter finds himself mysteriously going back to the 1920s every day at midnight."
231,A Star Is Born,-2018,R,136 min,"Drama, Music, Romance            ",7.7,"3,14,704","3,14,704",Bradley Cooper,"['Lady Gaga', 'Bradley Cooper', 'Sam Elliott', 'Greg Grunberg']",A musician helps a young singer find fame as age and alcoholism send his own career into a downward spiral.
232,The Lego Movie,-2014,PG,100 min,"Animation, Action, Adventure            ",7.7,"3,18,310","3,18,310",Christopher Miller,"['Phil Lord', 'Chris Pratt', 'Will Ferrell', 'Elizabeth Banks']","An ordinary LEGO construction worker, thought to be the prophesied as ""special"", is recruited to join a quest to stop an evil tyrant from gluing the LEGO universe into eternal stasis."
233,Gravity,-2013,PG-13,91 min,"Drama, Sci-Fi, Thriller            ",7.7,"7,52,706","7,52,706",Alfonso Cuarón,"['Sandra Bullock', 'George Clooney', 'Ed Harris', 'Orto Ignatiussen']",Two astronauts work together to survive after an accident leaves them stranded in space.
234,Star Trek Into Darkness,-2013,PG-13,132 min,"Action, Adventure, Sci-Fi            ",7.7,"4,57,536","4,57,536",J.J. Abrams,"['Chris Pine', 'Zachary Quinto', 'Zoe Saldana', 'Benedict Cumberbatch']","After the crew of the Enterprise find an unstoppable force of terror from within their own organization, Captain Kirk leads a manhunt to a war-zone world to capture a one-man weapon of mass destruction."
235,Beasts of No Nation,-2015,Not Rated,137 min,"Drama, War            ",7.7,"71,098","71,098",Cary Joji Fukunaga,"['Abraham Attah', 'Emmanuel Affadzi', 'Ricky Adelayitor', 'Andrew Adote']","A drama based on the experiences of Agu, a child soldier fighting in the civil war of an unnamed African country."
236,The Social Network,-2010,PG-13,120 min,"Biography, Drama            ",7.7,"6,05,720","6,05,720",David Fincher,"['Jesse Eisenberg', 'Andrew Garfield', 'Justin Timberlake', 'Rooney Mara']","As Harvard student Mark Zuckerberg creates the social networking site that would become known as Facebook, he is sued by the twins who claimed he stole their idea, and by the co-founder who was later squeezed out of the business."
237,X-Men: First Class,-2011,PG-13,131 min,"Action, Adventure, Sci-Fi            ",7.7,"6,35,027","6,35,027",Matthew Vaughn,"['James McAvoy', 'Michael Fassbender', 'Jennifer Lawrence', 'Kevin Bacon']","In the 1960s, superpowered humans Charles Xavier and Erik Lensherr work together to find others like them, but Erik's vengeful pursuit of an ambitious mutant who ruined his life causes a schism to divide them."
238,The Hangover,-2009,R,100 min,Comedy            ,7.7,"7,03,535","7,03,535",Todd Phillips,"['Zach Galifianakis', 'Bradley Cooper', 'Justin Bartha', 'Ed Helms']","Three buddies wake up from a bachelor party in Las Vegas, with no memory of the previous night and the bachelor missing. They make their way around the city in order to find their friend before his wedding."
239,Skyfall,-2012,PG-13,143 min,"Action, Adventure, Thriller            ",7.7,"6,18,438","6,18,438",Sam Mendes,"['Daniel Craig', 'Javier Bardem', 'Naomie Harris', 'Judi Dench']","James Bond's loyalty to M is tested when her past comes back to haunt her. When MI6 comes under attack, 007 must track down and destroy the threat, no matter how personal the cost."
240,Silver Linings Playbook,-2012,R,122 min,"Comedy, Drama, Romance            ",7.7,"6,49,065","6,49,065",David O. Russell,"['Bradley Cooper', 'Jennifer Lawrence', 'Robert De Niro', 'Jacki Weaver']","After a stint in a mental institution, former teacher Pat Solitano moves back in with his parents and tries to reconcile with his ex-wife. Things get more challenging when Pat meets Tiffany, a mysterious girl with problems of her own."
241,Argo,-2012,R,120 min,"Biography, Drama, Thriller            ",7.7,"5,61,272","5,61,272",Ben Affleck,"['Ben Affleck', 'Bryan Cranston', 'John Goodman', 'Alan Arkin']","Acting under the cover of a Hollywood producer scouting a location for a science fiction film, a CIA agent launches a dangerous operation to rescue six Americans in Tehran during the U.S. hostage crisis in Iran in 1979."
242,500 Days of Summer,-2009,PG-13,95 min,"Comedy, Drama, Romance            ",7.7,"4,62,605","4,62,605",Marc Webb,"['Zooey Deschanel', 'Joseph Gordon-Levitt', 'Geoffrey Arend', 'Chloë Grace Moretz']","An offbeat romantic comedy about a woman who doesn't believe true love exists, and the young man who falls for her."
243,Harry Potter and the Deathly Hallows: Part 1,-2010,PG-13,146 min,"Adventure, Family, Fantasy            ",7.7,"4,60,406","4,60,406",David Yates,"['Daniel Radcliffe', 'Emma Watson', 'Rupert Grint', 'Bill Nighy']","As Harry (Daniel Radcliffe), Ron (Rupert Grint), and Hermione (Emma Watson) race against time and evil to destroy the Horcruxes, they uncover the existence of the three most powerful objects in the wizarding world: the Deathly Hallows."
244,Ponyo,-2008,G,101 min,"Animation, Adventure, Comedy            ",7.7,"1,19,015","1,19,015",Hayao Miyazaki,"['Cate Blanchett', 'Matt Damon', 'Liam Neeson', 'Tomoko Yamaguchi']","A five-year-old boy develops a relationship with Ponyo, a young goldfish princess who longs to become a human after falling in love with him."
245,Frost/Nixon,-2008,R,122 min,"Biography, Drama, History            ",7.7,"1,01,033","1,01,033",Ron Howard,"['Frank Langella', 'Michael Sheen', 'Kevin Bacon', 'Sam Rockwell']",A dramatic retelling of the post-Watergate television interviews between British talk-show host David Frost and former president Richard Nixon.
246,Paprika,-2006,R,90 min,"Animation, Drama, Fantasy            ",7.7,"67,782","67,782",Satoshi Kon,"['Megumi Hayashibara', 'Tôru Emori', 'Katsunosuke Hori', 'Tôru Furuya']","When a machine that allows therapists to enter their patients' dreams is stolen, all Hell breaks loose. Only a young female therapist, Paprika, can stop it."
247,Changeling,-2008,R,141 min,"Biography, Crime, Drama            ",7.7,"2,32,556","2,32,556",Clint Eastwood,"['Angelina Jolie', 'Colm Feore', 'Amy Ryan', 'Gattlin Griffith']",Grief-stricken mother Christine Collins (Angelina Jolie) takes on the L.A.P.D. to her own detriment when it tries to pass off an obvious impostor as her missing child.
248,Flipped,(I) (2010),PG,90 min,"Comedy, Drama, Romance            ",7.7,"79,299","79,299",Rob Reiner,"['Madeline Carroll', 'Callan McAuliffe', 'Rebecca De Mornay', 'Anthony Edwards']",Two eighth-graders start to have feelings for each other despite being total opposites.
249,Death Note,-2006,Not Rated,126 min,"Crime, Drama, Fantasy            ",7.7,"28,103","28,103",Shûsuke Kaneko,"['Tatsuya Fujiwara', ""Ken'ichi Matsuyama"", 'Asaka Seto', 'Shigeki Hosokawa']","A battle between the world's two greatest minds begins when Light Yagami finds the Death Note, a notebook with the power to kill, and decides to rid the world of criminals."
