ID,Title,Relase,Audience Rating,Runtime,Genre,IMDB Rating,Votes,Box Office Earnings,Director,Actors,Description,Genre1,Genre2,Genre3,Drama,Crime,Adventure,Romance,SciFi,War,Family,Music,Comedy,Mystery,Musical,Biography,Action,Western,Thriller,Horror,FilmNoir,Fantasy,Sport,History,clean_plot,genre_new
249,"Black Cat, White Cat",-1998,R,127 min,"Comedy, Crime, Romance",8.1,"49,655","49,655",Emir Kusturica,"[Bajram Severdzan, ""Srdjan Zika Todorovic"", Branka Katic, Florijan Ajdini]",Matko and his son Zare live on the banks of the Danube river and get by through hustling and basically doing anything to make a living. In order to pay off a business debt Matko agrees to marry off Zare to the sister of a local gangster.,Comedy,Crime,Romance,0,1,0,1,0,0,0,0,1,0,0,0,0,0,0,0,0,0,0,0,matko son zare live banks danube river get hustling basically anything make living order pay business debt matko agrees marry zare sister local gangster,"['Comedy', ' Crime', ' Romance']"
250,The Big Lebowski,-1998,R,117 min,"Comedy, Crime, Sport",8.1,"7,08,691","7,08,691",Joel Coen,"[Ethan Coen, Jeff Bridges, John Goodman, Julianne Moore]","Jeff ""The Dude"" Lebowski, mistaken for a millionaire of the same name, seeks restitution for his ruined rug and enlists his bowling buddies to help get it.",Comedy,Crime,Sport,0,1,0,0,0,0,0,0,1,0,0,0,0,0,0,0,0,0,1,0,jeff dude lebowski mistaken millionaire name seeks restitution ruined rug enlists bowling buddies help get,"['Comedy', ' Crime', ' Sport']"
251,In the Mood for Love,-2000,PG,98 min,"Drama, Romance",8.1,"1,18,106","1,18,106",Kar-Wai Wong,"[Tony Chiu-Wai Leung, Maggie Cheung, Ping Lam Siu, ""Tung Cho Joe Cheung""]","Two neighbors, a woman and a man, form a strong bond after both suspect extramarital activities of their spouses. However, they agree to keep their bond platonic so as not to commit similar wrongs.",Drama,Romance,None,1,0,0,1,0,0,0,0,0,0,0,0,0,0,0,0,0,0,0,0,two neighbors woman man form strong bond suspect extramarital activities spouses however agree keep bond platonic commit similar wrongs,"['Drama', ' Romance']"
252,Trainspotting,-1996,R,93 min,Drama,8.1,"6,21,146","6,21,146",Danny Boyle,"[Ewan McGregor, Ewen Bremner, Jonny Lee Miller, Kevin McKidd]","Renton, deeply immersed in the Edinburgh drug scene, tries to clean up and get out, despite the allure of the drugs and influence of friends.",Drama,None,None,1,0,0,0,0,0,0,0,0,0,0,0,0,0,0,0,0,0,0,0,renton deeply immersed edinburgh drug scene tries clean get despite allure drugs influence friends,['Drama']
253,Fargo,-1996,R,98 min,"Crime, Drama, Thriller",8.1,"5,97,964","5,97,964",Joel Coen,"[Ethan Coen, William H. Macy, Frances McDormand, Steve Buscemi]",Jerry Lundegaards inept crime falls apart due to his and his henchmens bungling and the persistent police work of the quite pregnant Marge Gunderson.,Crime,Drama,Thriller,1,1,0,0,0,0,0,0,0,0,0,0,0,0,1,0,0,0,0,0,jerry lundegaards inept crime falls apart due henchmens bungling persistent police work quite pregnant marge gunderson,"['Crime', ' Drama', ' Thriller']"
254,Underground,-1995,Not Rated,167 min,"Comedy, Drama, War",8.1,"53,974","53,974",Emir Kusturica,"[""Predrag Miki Manojlovic"", Lazar Ristovski, Mirjana Jokovic, Slavko Stimac]","A group of Serbian socialists prepares for the war in a surreal underground filled by parties, tragedies, love and hate.",Comedy,Drama,War,1,0,0,0,0,1,0,0,1,0,0,0,0,0,0,0,0,0,0,0,group serbian socialists prepares war surreal underground filled parties tragedies love hate,"['Comedy', ' Drama', ' War']"
255,La Haine,-1995,Not Rated,98 min,"Crime, Drama",8.1,"1,43,287","1,43,287",Mathieu Kassovitz,"[Vincent Cassel, Hubert Koundé, Saïd Taghmaoui, Abdel Ahmed Ghili]",24 hours in the lives of three young men in the French suburbs the day after a violent riot.,Crime,Drama,None,1,1,0,0,0,0,0,0,0,0,0,0,0,0,0,0,0,0,0,0,hours lives three young men french suburbs day violent riot,"['Crime', ' Drama']"
256,Dilwale Dulhania Le Jayenge,-1995,Not Rated,181 min,"Drama, Romance",8.1,"61,509","61,509",Aditya Chopra,"[Shah Rukh Khan, Kajol, Amrish Puri, Farida Jalal]","When Raj meets Simran in Europe, it isnt love at first sight but when Simran moves to India for an arranged marriage, love makes its presence felt.",Drama,Romance,None,1,0,0,1,0,0,0,0,0,0,0,0,0,0,0,0,0,0,0,0,raj meets simran europe isnt love first sight simran moves india arranged marriage love makes presence felt,"['Drama', ' Romance']"
257,Before Sunrise,-1995,R,101 min,"Drama, Romance",8.1,"2,60,439","2,60,439",Richard Linklater,"[Ethan Hawke, Julie Delpy, Andrea Eckert, Hanno Pöschl]","A young man and woman meet on a train in Europe, and wind up spending one evening together in Vienna. Unfortunately, both know that this will probably be their only night together.",Drama,Romance,None,1,0,0,1,0,0,0,0,0,0,0,0,0,0,0,0,0,0,0,0,young man woman meet train europe wind spending one evening together vienna unfortunately know probably night together,"['Drama', ' Romance']"
258,Three Colors: Red,-1994,R,99 min,"Drama, Mystery, Romance",8.1,"87,015","87,015",Krzysztof Kieslowski,"[Irène Jacob, Jean-Louis Trintignant, Frédérique Feder, Jean-Pierre Lorit]",A model discovers a retired judge is keen on invading peoples privacy.,Drama,Mystery,Romance,1,0,0,1,0,0,0,0,0,1,0,0,0,0,0,0,0,0,0,0,model discovers retired judge keen invading peoples privacy,"['Drama', ' Mystery', ' Romance']"
259,Chungking Express,-1994,PG-13,102 min,"Comedy, Crime, Drama",8.1,"59,415","59,415",Kar-Wai Wong,"[Brigitte Lin, Takeshi Kaneshiro, Tony Chiu-Wai Leung, Faye Wong]","Two melancholy Hong Kong policemen fall in love: one with a mysterious female underworld figure, the other with a beautiful and ethereal server at a late-night restaurant he frequents.",Comedy,Crime,Drama,1,1,0,0,0,0,0,0,1,0,0,0,0,0,0,0,0,0,0,0,two melancholy hong kong policemen fall love one mysterious female underworld figure beautiful ethereal server late night restaurant frequents,"['Comedy', ' Crime', ' Drama']"
260,Jurassic Park,-1993,PG-13,127 min,"Action, Adventure, SciFi",8.1,"8,39,293","8,39,293",Steven Spielberg,"[Sam Neill, Laura Dern, Jeff Goldblum, Richard Attenborough]",A pragmatic paleontologist visiting an almost complete theme park is tasked with protecting a couple of kids after a power failure causes the parks cloned dinosaurs to run loose.,Action,Adventure,SciFi,0,0,1,0,1,0,0,0,0,0,0,0,1,0,0,0,0,0,0,0,pragmatic paleontologist visiting almost complete theme park tasked protecting couple kids power failure causes parks cloned dinosaurs run loose,"['Action', ' Adventure', ' SciFi']"
261,In the Name of the Father,-1993,R,133 min,"Biography, Drama",8.1,"1,51,806","1,51,806",Jim Sheridan,"[Daniel Day-Lewis, Pete Postlethwaite, Alison Crosbie, Philip King]",A mans coerced confession to an I.R.A. bombing he did not commit results in the imprisonment of his father as well. An English lawyer fights to free them.,Biography,Drama,None,1,0,0,0,0,0,0,0,0,0,0,1,0,0,0,0,0,0,0,0,mans coerced confession r bombing commit results imprisonment father well english lawyer fights free,"['Biography', ' Drama']"
262,Raise the Red Lantern,-1991,PG,125 min,"Drama, History, Romance",8.1,"28,516","28,516",Yimou Zhang,"[Li Gong, Jingwu Ma, Saifei He, Cuifen Cao]","A young woman becomes the fourth wife of a wealthy lord, and must learn to live with the strict rules and tensions within the household.",Drama,History,Romance,1,0,0,1,0,0,0,0,0,0,0,0,0,0,0,0,0,0,0,1,young woman becomes fourth wife wealthy lord must learn live strict rules tensions within household,"['Drama', ' History', ' Romance']"
263,Dead Poets Society,-1989,PG,128 min,"Comedy, Drama",8.1,"4,08,302","4,08,302",Peter Weir,"[Robin Williams, Robert Sean Leonard, Ethan Hawke, Josh Charles]",Maverick teacher John Keating uses poetry to embolden his boarding school students to new heights of self-expression.,Comedy,Drama,None,1,0,0,0,0,0,0,0,1,0,0,0,0,0,0,0,0,0,0,0,maverick teacher john keating uses poetry embolden boarding school students new heights self expression,"['Comedy', ' Drama']"
264,The Princess Bride,-1987,PG,98 min,"Adventure, Family, Fantasy",8.1,"3,83,185","3,83,185",Rob Reiner,"[Cary Elwes, Mandy Patinkin, Robin Wright, Chris Sarandon]","While home sick in bed, a young boys grandfather reads him the story of a farmboy-turned-pirate who encounters numerous obstacles, enemies and allies in his quest to be reunited with his true love.",Adventure,Family,Fantasy,0,0,1,0,0,0,1,0,0,0,0,0,0,0,0,0,0,1,0,0,home sick bed young boys grandfather reads story farmboy turned pirate encounters numerous obstacles enemies allies quest reunited true love,"['Adventure', ' Family', ' Fantasy']"
265,Stand by Me,-1986,R,89 min,"Adventure, Drama",8.1,"3,53,821","3,53,821",Rob Reiner,"[Wil Wheaton, River Phoenix, Corey Feldman, ""Jerry OConnell""]","After the death of one of his friends, a writer recounts a childhood journey with his friends to find the body of a missing boy.",Adventure,Drama,None,1,0,1,0,0,0,0,0,0,0,0,0,0,0,0,0,0,0,0,0,death one friends writer recounts childhood journey friends find body missing boy,"['Adventure', ' Drama']"
266,Platoon,-1986,R,120 min,"Drama, War",8.1,"3,71,805","3,71,805",Oliver Stone,"[Charlie Sheen, Tom Berenger, Willem Dafoe, Keith David]",A young soldier in Vietnam faces a moral crisis when confronted with the horrors of war and the duality of man.,Drama,War,None,1,0,0,0,0,1,0,0,0,0,0,0,0,0,0,0,0,0,0,0,young soldier vietnam faces moral crisis confronted horrors war duality man,"['Drama', ' War']"
267,"Paris, Texas",-1984,R,145 min,Drama,8.1,"85,383","85,383",Wim Wenders,"[Harry Dean Stanton, Nastassja Kinski, Dean Stockwell, Aurore Clément]","Travis Henderson, an aimless drifter who has been missing for four years, wanders out of the desert and must reconnect with society, himself, his life, and his family.",Drama,None,None,1,0,0,0,0,0,0,0,0,0,0,0,0,0,0,0,0,0,0,0,travis henderson aimless drifter missing four years wanders desert must reconnect society life family,['Drama']
268,Nausicaä of the Valley of the Wind,-1984,PG,117 min,"Animation, Adventure, Fantasy",8.1,"1,43,589","1,43,589",Hayao Miyazaki,"[Sumi Shimamoto, Mahito Tsujimura, Hisako Kyôda, Gorô Naya]",Warrior and pacifist Princess Nausicaä desperately struggles to prevent two warring nations from destroying themselves and their dying planet.,Animation,Adventure,Fantasy,0,0,1,0,0,0,0,0,0,0,0,0,0,0,0,0,0,1,0,0,warrior pacifist princess nausica desperately struggles prevent two warring nations destroying dying planet,"['Animation', ' Adventure', ' Fantasy']"
269,The Thing,-1982,R,109 min,"Horror, Mystery, SciFi",8.1,"3,57,818","3,57,818",John Carpenter,"[Kurt Russell, Wilford Brimley, Keith David, Richard Masur]",A research team in Antarctica is hunted by a shape-shifting alien that assumes the appearance of its victims.,Horror,Mystery,SciFi,0,0,0,0,1,0,0,0,0,1,0,0,0,0,0,1,0,0,0,0,research team antarctica hunted shape shifting alien assumes appearance victims,"['Horror', ' Mystery', ' SciFi']"
270,Pink Floyd: The Wall,-1982,R,95 min,"Fantasy, Music",8.1,"74,318","74,318",Alan Parker,"[Bob Geldof, Christine Hargreaves, James Laurenson, Eleanor David]",A confined but troubled rock star descends into madness in the midst of his physical and social isolation from everyone.,Fantasy,Music,None,0,0,0,0,0,0,0,1,0,0,0,0,0,0,0,0,0,1,0,0,confined troubled rock star descends madness midst physical social isolation everyone,"['Fantasy', ' Music']"
271,Fitzcarraldo,-1982,PG,158 min,"Adventure, Drama",8.1,"30,301","30,301",Werner Herzog,"[Klaus Kinski, Claudia Cardinale, José Lewgoy, Miguel Ángel Fuentes]","The story of Brian Sweeney Fitzgerald, an extremely determined man who intends to build an opera house in the middle of a jungle.",Adventure,Drama,None,1,0,1,0,0,0,0,0,0,0,0,0,0,0,0,0,0,0,0,0,story brian sweeney fitzgerald extremely determined man intends build opera house middle jungle,"['Adventure', ' Drama']"
272,Fanny and Alexander,-1982,R,188 min,Drama,8.1,"55,960","55,960",Ingmar Bergman,"[Bertil Guve, Pernilla Allwin, Kristina Adolphson, Börje Ahlstedt]","Two young Swedish children experience the many comedies and tragedies of their family, the Ekdahls.",Drama,None,None,1,0,0,0,0,0,0,0,0,0,0,0,0,0,0,0,0,0,0,0,two young swedish children experience many comedies tragedies family ekdahls,['Drama']
273,Blade Runner,-1982,R,117 min,"Action, SciFi, Thriller",8.1,"6,74,716","6,74,716",Ridley Scott,"[Harrison Ford, Rutger Hauer, Sean Young, Edward James Olmos]","A blade runner must pursue and terminate four replicants who stole a ship in space, and have returned to Earth to find their creator.",Action,SciFi,Thriller,0,0,0,0,1,0,0,0,0,0,0,0,1,0,1,0,0,0,0,0,blade runner must pursue terminate four replicants stole ship space returned earth find creator,"['Action', ' SciFi', ' Thriller']"
274,The Elephant Man,-1980,PG,124 min,"Biography, Drama",8.1,"2,13,305","2,13,305",David Lynch,"[Anthony Hopkins, John Hurt, Anne Bancroft, John Gielgud]","A Victorian surgeon rescues a heavily disfigured man who is mistreated while scraping a living as a side-show freak. Behind his monstrous façade, there is revealed a person of kindness, intelligence and sophistication.",Biography,Drama,None,1,0,0,0,0,0,0,0,0,0,0,1,0,0,0,0,0,0,0,0,victorian surgeon rescues heavily disfigured man mistreated scraping living side show freak behind monstrous fa ade revealed person kindness intelligence sophistication,"['Biography', ' Drama']"
275,Monty Pythons Life of Brian,-1979,R,94 min,Comedy,8.1,"3,57,503","3,57,503",Terry Jones,"[Graham Chapman, John Cleese, Michael Palin, Terry Gilliam]","Born on the original Christmas in the stable next door to Jesus Christ, Brian of Nazareth spends his life being mistaken for a messiah.",Comedy,None,None,0,0,0,0,0,0,0,0,1,0,0,0,0,0,0,0,0,0,0,0,born original christmas stable next door jesus christ brian nazareth spends life mistaken messiah,['Comedy']
276,The Deer Hunter,-1978,R,183 min,"Drama, War",8.1,"3,02,824","3,02,824",Michael Cimino,"[Robert De Niro, Christopher Walken, John Cazale, John Savage]",An in-depth examination of the ways in which the U.S. Vietnam War impacts and disrupts the lives of people in a small industrial town in Pennsylvania.,Drama,War,None,1,0,0,0,0,1,0,0,0,0,0,0,0,0,0,0,0,0,0,0,depth examination ways u vietnam war impacts disrupts lives people small industrial town pennsylvania,"['Drama', ' War']"
277,Rocky,-1976,PG,120 min,"Drama, Sport",8.1,"5,03,888","5,03,888",John G. Avildsen,"[Sylvester Stallone, Talia Shire, Burt Young, Carl Weathers]",A small-time boxer gets a supremely rare chance to fight a heavy-weight champion in a bout in which he strives to go the distance for his self-respect.,Drama,Sport,None,1,0,0,0,0,0,0,0,0,0,0,0,0,0,0,0,0,0,1,0,small time boxer gets supremely rare chance fight heavy weight champion bout strives go distance self respect,"['Drama', ' Sport']"
278,Network,-1976,R,121 min,Drama,8.1,"1,41,086","1,41,086",Sidney Lumet,"[Faye Dunaway, William Holden, Peter Finch, Robert Duvall]",A television network cynically exploits a deranged former anchors ravings and revelations about the news media for its own profit.,Drama,None,None,1,0,0,0,0,0,0,0,0,0,0,0,0,0,0,0,0,0,0,0,television network cynically exploits deranged former anchors ravings revelations news media profit,['Drama']
279,Barry Lyndon,-1975,PG,185 min,"Adventure, Drama, History",8.1,"1,44,226","1,44,226",Stanley Kubrick,"[""Ryan ONeal"", Marisa Berenson, Patrick Magee, Hardy Krüger]",An Irish rogue wins the heart of a rich widow and assumes her dead husbands aristocratic position in 18th-century England.,Adventure,Drama,History,1,0,1,0,0,0,0,0,0,0,0,0,0,0,0,0,0,0,0,1,irish rogue wins heart rich widow assumes dead husbands aristocratic position th century england,"['Adventure', ' Drama', ' History']"
280,The Mirror,-1975,G,107 min,"Biography, Drama",8.1,"37,736","37,736",Andrei Tarkovsky,"[Margarita Terekhova, Filipp Yankovskiy, Ignat Daniltsev, Oleg Yankovskiy]","A dying man in his forties remembers his past. His childhood, his mother, the war, personal moments and things that tell of the recent history of all the Russian nation.",Biography,Drama,None,1,0,0,0,0,0,0,0,0,0,0,1,0,0,0,0,0,0,0,0,dying man forties remembers past childhood mother war personal moments things tell recent history russian nation,"['Biography', ' Drama']"
281,Paper Moon,-1973,PG,102 min,"Comedy, Drama",8.1,"40,996","40,996",Peter Bogdanovich,"[""Ryan ONeal"", ""Tatum ONeal"", Madeline Kahn, John Hillerman]","During the Great Depression, a con man finds himself saddled with a young girl who may or may not be his daughter, and the two forge an unlikely partnership.",Comedy,Drama,None,1,0,0,0,0,0,0,0,1,0,0,0,0,0,0,0,0,0,0,0,great depression con man finds saddled young girl may may daughter two forge unlikely partnership,"['Comedy', ' Drama']"
282,Cries & Whispers,-1972,R,91 min,Drama,8.1,"28,911","28,911",Ingmar Bergman,"[Harriet Andersson, Liv Ullmann, Kari Sylwan, Ingrid Thulin]","When a woman dying of cancer in early twentieth-century Sweden is visited by her two sisters, long-repressed feelings between the siblings rise to the surface.",Drama,None,None,1,0,0,0,0,0,0,0,0,0,0,0,0,0,0,0,0,0,0,0,woman dying cancer early twentieth century sweden visited two sisters long repressed feelings siblings rise surface,['Drama']
283,Solaris,-1972,PG,167 min,"Drama, Mystery, SciFi",8.1,"77,560","77,560",Andrei Tarkovsky,"[Natalya Bondarchuk, Donatas Banionis, Jüri Järvet, Vladislav Dvorzhetskiy]",A psychologist is sent to a station orbiting a distant planet in order to discover what has caused the crew to go insane.,Drama,Mystery,SciFi,1,0,0,0,1,0,0,0,0,1,0,0,0,0,0,0,0,0,0,0,psychologist sent station orbiting distant planet order discover caused crew go insane,"['Drama', ' Mystery', ' SciFi']"
284,Le Samouraï,-1967,GP,101 min,"Crime, Drama, Mystery",8.1,"43,549","43,549",Jean-Pierre Melville,"[Alain Delon, François Périer, Nathalie Delon, Cathy Rosier]",After professional hitman Jef Costello is seen by witnesses his efforts to provide himself an alibi drive him further into a corner.,Crime,Drama,Mystery,1,1,0,0,0,0,0,0,0,1,0,0,0,0,0,0,0,0,0,0,professional hitman jef costello seen witnesses efforts provide alibi drive corner,"['Crime', ' Drama', ' Mystery']"
285,Cool Hand Luke,-1967,GP,127 min,"Crime, Drama",8.1,"1,57,651","1,57,651",Stuart Rosenberg,"[Paul Newman, George Kennedy, Strother Martin, J.D. Cannon]","A laid back Southern man is sentenced to two years in a rural prison, but refuses to conform.",Crime,Drama,None,1,1,0,0,0,0,0,0,0,0,0,0,0,0,0,0,0,0,0,0,laid back southern man sentenced two years rural prison refuses conform,"['Crime', ' Drama']"
286,Persona,-1966,Not Rated,83 min,"Drama, Thriller",8.1,"97,919","97,919",Ingmar Bergman,"[Bibi Andersson, Liv Ullmann, Margaretha Krook, Gunnar Björnstrand]",A nurse is put in charge of a mute actress and finds that their personae are melding together.,Drama,Thriller,None,1,0,0,0,0,0,0,0,0,0,0,0,0,0,1,0,0,0,0,0,nurse put charge mute actress finds personae melding together,"['Drama', ' Thriller']"
287,Andrei Rublev,-1966,R,205 min,"Biography, Drama, History",8.1,"44,358","44,358",Andrei Tarkovsky,"[Anatoliy Solonitsyn, Ivan Lapikov, Nikolay Grinko, Nikolay Sergeev]","The life, times and afflictions of the fifteenth-century Russian iconographer St. Andrei Rublev.",Biography,Drama,History,1,0,0,0,0,0,0,0,0,0,0,1,0,0,0,0,0,0,0,1,life times afflictions fifteenth century russian iconographer st andrei rublev,"['Biography', ' Drama', ' History']"
288,The Battle of Algiers,-1966,Not Rated,121 min,"Drama, War",8.1,"50,648","50,648",Gillo Pontecorvo,"[Brahim Hadjadj, Jean Martin, Yacef Saadi, Samia Kerbash]","In the 1950s, fear and violence escalate as the people of Algiers fight for independence from the French government.",Drama,War,None,1,0,0,0,0,1,0,0,0,0,0,0,0,0,0,0,0,0,0,0,fear violence escalate people algiers fight independence french government,"['Drama', ' War']"
289,The Exterminating Angel,-1962,Not Rated,95 min,"Drama, Fantasy",8.1,"28,520","28,520",Luis Buñuel,"[Silvia Pinal, Jacqueline Andere, Enrique Rambal, José Baviera]",The guests at an upper-class dinner party find themselves unable to leave.,Drama,Fantasy,None,1,0,0,0,0,0,0,0,0,0,0,0,0,0,0,0,0,1,0,0,guests upper class dinner party find unable leave,"['Drama', ' Fantasy']"
290,What Ever Happened to Baby Jane?,-1962,Passed,134 min,"Drama, Horror, Thriller",8.1,"48,521","48,521",Robert Aldrich,"[Bette Davis, Joan Crawford, Victor Buono, Wesley Addy]",A former child star torments her paraplegic sister in their decaying Hollywood mansion.,Drama,Horror,Thriller,1,0,0,0,0,0,0,0,0,0,0,0,0,0,1,1,0,0,0,0,former child star torments paraplegic sister decaying hollywood mansion,"['Drama', ' Horror', ' Thriller']"
291,Sanjuro,-1962,Not Rated,96 min,"Action, Comedy, Crime",8.1,"31,083","31,083",Akira Kurosawa,"[Toshirô Mifune, Tatsuya Nakadai, Keiju Kobayashi, Yûnosuke Itô]","A crafty samurai helps a young man and his fellow clansmen save his uncle, who has been framed and imprisoned by a corrupt superintendent.",Action,Comedy,Crime,0,1,0,0,0,0,0,0,1,0,0,0,1,0,0,0,0,0,0,0,crafty samurai helps young man fellow clansmen save uncle framed imprisoned corrupt superintendent,"['Action', ' Comedy', ' Crime']"
292,The Man Who Shot Liberty Valance,-1962,Not Rated,123 min,"Drama, Western",8.1,"66,912","66,912",John Ford,"[James Stewart, John Wayne, Vera Miles, Lee Marvin]",A senator returns to a western town for the funeral of an old friend and tells the story of his origins.,Drama,Western,None,1,0,0,0,0,0,0,0,0,0,0,0,0,1,0,0,0,0,0,0,senator returns western town funeral old friend tells story origins,"['Drama', ' Western']"
293,Ivans Childhood,-1962,Not Rated,84 min,"Drama, War",8.1,"29,932","29,932",Andrei Tarkovsky,"[Eduard Abalov, Nikolay Burlyaev, Valentin Zubkov, Evgeniy Zharikov]","In WW2, twelve year old Soviet orphan Ivan Bondarev works for the Soviet army as a scout behind the German lines and strikes a friendship with three sympathetic Soviet officers.",Drama,War,None,1,0,0,0,0,1,0,0,0,0,0,0,0,0,0,0,0,0,0,0,ww twelve year old soviet orphan ivan bondarev works soviet army scout behind german lines strikes friendship three sympathetic soviet officers,"['Drama', ' War']"
294,The Virgin Spring,-1960,Not Rated,89 min,Drama,8.1,"25,758","25,758",Ingmar Bergman,"[Max von Sydow, Birgitta Valberg, Gunnel Lindblom, Birgitta Pettersson]","An innocent yet pampered young virgin and her familys pregnant and jealous servant set out to deliver candles to church, but only one returns from events that transpire in the woods along the way.",Drama,None,None,1,0,0,0,0,0,0,0,0,0,0,0,0,0,0,0,0,0,0,0,innocent yet pampered young virgin familys pregnant jealous servant set deliver candles church one returns events transpire woods along way,['Drama']
295,Inherit the Wind,-1960,Passed,128 min,"Biography, Drama, History",8.1,"26,483","26,483",Stanley Kramer,"[Spencer Tracy, Fredric March, Gene Kelly, Dick York]","Based on a real-life case in 1925, two great lawyers argue the case for and against a science teacher accused of the crime of teaching evolution.",Biography,Drama,History,1,0,0,0,0,0,0,0,0,0,0,1,0,0,0,0,0,0,0,1,based real life case two great lawyers argue case science teacher accused crime teaching evolution,"['Biography', ' Drama', ' History']"
296,The 400 Blows,-1959,Not Rated,99 min,"Crime, Drama",8.1,"1,01,123","1,01,123",François Truffaut,"[Jean-Pierre Léaud, Albert Rémy, Claire Maurier, Guy Decomble]","A young boy, left without attention, delves into a life of petty crime.",Crime,Drama,None,1,1,0,0,0,0,0,0,0,0,0,0,0,0,0,0,0,0,0,0,young boy left without attention delves life petty crime,"['Crime', ' Drama']"
297,Ben-Hur,-1959,G,212 min,"Adventure, Drama, History",8.1,"2,13,912","2,13,912",William Wyler,"[Charlton Heston, Jack Hawkins, Stephen Boyd, Haya Harareet]","After a Jewish prince is betrayed and sent into slavery by a Roman friend, he regains his freedom and comes back for revenge.",Adventure,Drama,History,1,0,1,0,0,0,0,0,0,0,0,0,0,0,0,0,0,0,0,1,jewish prince betrayed sent slavery roman friend regains freedom comes back revenge,"['Adventure', ' Drama', ' History']"
298,The Hidden Fortress,-1958,Not Rated,126 min,"Adventure, Drama",8.1,"32,861","32,861",Akira Kurosawa,"[Toshirô Mifune, Misa Uehara, Minoru Chiaki, Kamatari Fujiwara]","Lured by gold, two greedy peasants escort a man and woman across enemy lines. However, they do not realize that their companions are actually a princess and her general.",Adventure,Drama,None,1,0,1,0,0,0,0,0,0,0,0,0,0,0,0,0,0,0,0,0,lured gold two greedy peasants escort man woman across enemy lines however realize companions actually princess general,"['Adventure', ' Drama']"
299,Sweet Smell of Success,-1957,Approved,96 min,"Drama, FilmNoir",8.1,"27,059","27,059",Alexander Mackendrick,"[Burt Lancaster, Tony Curtis, Susan Harrison, Martin Milner]",Powerful but unethical Broadway columnist J.J. Hunsecker coerces unscrupulous press agent Sidney Falco into breaking up his sisters romance with a jazz musician.,Drama,FilmNoir,None,1,0,0,0,0,0,0,0,0,0,0,0,0,0,0,0,1,0,0,0,powerful unethical broadway columnist j j hunsecker coerces unscrupulous press agent sidney falco breaking sisters romance jazz musician,"['Drama', ' FilmNoir']"
300,Nights of Cabiria,-1957,Not Rated,110 min,Drama,8.1,"41,634","41,634",Federico Fellini,"[Giulietta Masina, François Périer, Franca Marzi, Dorian Gray]",A waifish prostitute wanders the streets of Rome looking for true love but finds only heartbreak.,Drama,None,None,1,0,0,0,0,0,0,0,0,0,0,0,0,0,0,0,0,0,0,0,waifish prostitute wanders streets rome looking true love finds heartbreak,['Drama']
