ID,Title,Relase,Audience Rating,Runtime,Genre,IMDB Rating,Votes,Box Office Earnings,Director,Actors,Description,Genre1,Genre2,Genre3,Drama,Crime,Adventure,Romance,SciFi,War,Family,Music,Comedy,Mystery,Musical,Biography,Action,Western,Thriller,Horror,FilmNoir,Fantasy,Sport,History,clean_plot,genre_new
702,Red River,-1948,Passed,133 min,"Action, Adventure, Drama",7.8,"27,246","27,246",Howard Hawks,"[Arthur Rosson, John Wayne, Montgomery Clift, Joanne Dru]","Dunson leads a cattle drive, the culmination of over 14 years of work, to its destination in Missouri. But his tyrannical behavior along the way causes a mutiny, led by his adopted son.",Action,Adventure,Drama,1,0,1,0,0,0,0,0,0,0,0,0,1,0,0,0,0,0,0,0,dunson leads cattle drive culmination years work destination missouri tyrannical behavior along way causes mutiny led adopted son,"['Action', ' Adventure', ' Drama']"
703,Key Largo,-1948,Not Rated,100 min,"Action, Crime, Drama",7.8,"36,136","36,136",John Huston,"[Humphrey Bogart, Edward G. Robinson, Lauren Bacall, Lionel Barrymore]","A man visits his war buddys family hotel and finds a gangster running things. As a hurricane approaches, the two end up confronting each other.",Action,Crime,Drama,1,1,0,0,0,0,0,0,0,0,0,0,1,0,0,0,0,0,0,0,man visits war buddys family hotel finds gangster running things hurricane approaches two end confronting,"['Action', ' Crime', ' Drama']"
704,To Have and Have Not,-1944,Passed,100 min,"Adventure, Comedy, FilmNoir",7.8,"30,083","30,083",Howard Hawks,"[Humphrey Bogart, Lauren Bacall, Walter Brennan, Dolores Moran]","During World War II, American expatriate Harry Morgan helps transport a French Resistance leader and his beautiful wife to Martinique while romancing a sensuous lounge singer.",Adventure,Comedy,FilmNoir,0,0,1,0,0,0,0,0,1,0,0,0,0,0,0,0,1,0,0,0,world war ii american expatriate harry morgan helps transport french resistance leader beautiful wife martinique romancing sensuous lounge singer,"['Adventure', ' Comedy', ' FilmNoir']"
705,Shadow of a Doubt,-1943,PG,108 min,Thriller,7.8,"57,659","57,659",Alfred Hitchcock,"[Teresa Wright, Joseph Cotten, Macdonald Carey, Henry Travers]",A young woman discovers her visiting uncle may not be the man he seems to be.,Thriller,None,None,0,0,0,0,0,0,0,0,0,0,0,0,0,0,1,0,0,0,0,0,young woman discovers visiting uncle may man seems,['Thriller']
706,Fantasia,-1940,G,125 min,"Animation, Family, Fantasy",7.8,"86,414","86,414",James Algar,"[Samuel Armstrong, Ford Beebe Jr., Norman Ferguson, David Hand]",A collection of animated interpretations of great works of Western classical music.,Animation,Family,Fantasy,0,0,0,0,0,0,1,0,0,0,0,0,0,0,0,0,0,1,0,0,collection animated interpretations great works western classical music,"['Animation', ' Family', ' Fantasy']"
707,The Lady Vanishes,-1938,Not Rated,96 min,"Mystery, Thriller",7.8,"45,855","45,855",Alfred Hitchcock,"[Margaret Lockwood, Michael Redgrave, Paul Lukas, May Whitty]","While travelling in continental Europe, a rich young playgirl realizes that an elderly lady seems to have disappeared from the train.",Mystery,Thriller,None,0,0,0,0,0,0,0,0,0,1,0,0,0,0,1,0,0,0,0,0,travelling continental europe rich young playgirl realizes elderly lady seems disappeared train,"['Mystery', ' Thriller']"
708,Bride of Frankenstein,-1935,Not Rated,75 min,"Drama, Horror, SciFi",7.8,"41,961","41,961",James Whale,"[Boris Karloff, Elsa Lanchester, Colin Clive, Valerie Hobson]","Mary Shelley reveals the main characters of her novel survived: Dr. Frankenstein, goaded by an even madder scientist, builds his monster a mate.",Drama,Horror,SciFi,1,0,0,0,1,0,0,0,0,0,0,0,0,0,0,1,0,0,0,0,mary shelley reveals main characters novel survived dr frankenstein goaded even madder scientist builds monster mate,"['Drama', ' Horror', ' SciFi']"
709,Duck Soup,-1933,Not Rated,69 min,"Comedy, Musical, War",7.8,"54,544","54,544",Leo McCarey,"[Groucho Marx, Harpo Marx, Chico Marx, Zeppo Marx]",Rufus T. Firefly is named president/dictator of bankrupt Freedonia and declares war on neighboring Sylvania over the love of wealthy Mrs. Teasdale.,Comedy,Musical,War,0,0,0,0,0,1,0,0,1,0,1,0,0,0,0,0,0,0,0,0,rufus firefly named president dictator bankrupt freedonia declares war neighboring sylvania love wealthy mrs teasdale,"['Comedy', ' Musical', ' War']"
710,Frankenstein,-1931,Passed,70 min,"Drama, Horror, Romance",7.8,"62,995","62,995",James Whale,"[Colin Clive, Mae Clarke, Boris Karloff, John Boles]",An obsessed scientist assembles a living being from parts of exhumed corpses.,Drama,Horror,Romance,1,0,0,1,0,0,0,0,0,0,0,0,0,0,0,1,0,0,0,0,obsessed scientist assembles living parts exhumed corpses,"['Drama', ' Horror', ' Romance']"
711,Once Upon a Time... in Hollywood,-2019,R,161 min,"Comedy, Drama",7.7,"4,94,707","4,94,707",Quentin Tarantino,"[Leonardo DiCaprio, Brad Pitt, Margot Robbie, Emile Hirsch]",A faded television actor and his stunt double strive to achieve fame and success in the final years of Hollywoods Golden Age in 1969 Los Angeles.,Comedy,Drama,None,1,0,0,0,0,0,0,0,1,0,0,0,0,0,0,0,0,0,0,0,faded television actor stunt double strive achieve fame success final years hollywoods golden age los angeles,"['Comedy', ' Drama']"
712,Roma,-2018,R,135 min,Drama,7.7,"1,33,217","1,33,217",Alfonso Cuarón,"[Yalitza Aparicio, Marina de Tavira, Diego Cortina Autrey, Carlos Peralta]",A year in the life of a middle-class familys maid in Mexico City in the early 1970s.,Drama,None,None,1,0,0,0,0,0,0,0,0,0,0,0,0,0,0,0,0,0,0,0,year life middle class familys maid mexico city early,['Drama']
713,Deadpool 2,-2018,R,119 min,"Action, Adventure, Comedy",7.7,"4,56,903","4,56,903",David Leitch,"[Ryan Reynolds, Josh Brolin, Morena Baccarin, Julian Dennison]","Foul-mouthed mutant mercenary Wade Wilson (a.k.a. Deadpool), brings together a team of fellow mutant rogues to protect a young boy with supernatural abilities from the brutal, time-traveling cyborg Cable.",Action,Adventure,Comedy,0,0,1,0,0,0,0,0,1,0,0,0,1,0,0,0,0,0,0,0,foul mouthed mutant mercenary wade wilson k deadpool brings together team fellow mutant rogues protect young boy supernatural abilities brutal time traveling cyborg cable,"['Action', ' Adventure', ' Comedy']"
714,Wind River,-2017,R,107 min,"Crime, Drama, Mystery",7.7,"1,93,862","1,93,862",Taylor Sheridan,"[Kelsey Asbille, Jeremy Renner, Julia Jones, Teo Briones]",A veteran hunter helps an FBI agent investigate the murder of a young woman on a Wyoming Native American reservation.,Crime,Drama,Mystery,1,1,0,0,0,0,0,0,0,1,0,0,0,0,0,0,0,0,0,0,veteran hunter helps fbi agent investigate murder young woman wyoming native american reservation,"['Crime', ' Drama', ' Mystery']"
715,Get Out,(I) (2017),R,104 min,"Horror, Mystery, Thriller",7.7,"4,67,661","4,67,661",Jordan Peele,"[Daniel Kaluuya, Allison Williams, Bradley Whitford, Catherine Keener]","A young African-American visits his white girlfriends parents for the weekend, where his simmering uneasiness about their reception of him eventually reaches a boiling point.",Horror,Mystery,Thriller,0,0,0,0,0,0,0,0,0,1,0,0,0,0,1,1,0,0,0,0,young african american visits white girlfriends parents weekend simmering uneasiness reception eventually reaches boiling point,"['Horror', ' Mystery', ' Thriller']"
716,Mission: Impossible - Fallout,-2018,PG-13,147 min,"Action, Adventure, Thriller",7.7,"2,78,234","2,78,234",Christopher McQuarrie,"[Tom Cruise, Henry Cavill, Ving Rhames, Simon Pegg]","Ethan Hunt and his IMF team, along with some familiar allies, race against time after a mission gone wrong.",Action,Adventure,Thriller,0,0,1,0,0,0,0,0,0,0,0,0,1,0,1,0,0,0,0,0,ethan hunt imf team along familiar allies race time mission gone wrong,"['Action', ' Adventure', ' Thriller']"
717,A Man Called Ove,-2015,PG-13,116 min,"Comedy, Drama, Romance",7.7,"44,561","44,561",Hannes Holm,"[Rolf Lassgård, Bahar Pars, Filip Berg, Ida Engvoll]","Ove, an ill-tempered, isolated retiree who spends his days enforcing block association rules and visiting his wifes grave, has finally given up on life just as an unlikely friendship develops with his boisterous new neighbors.",Comedy,Drama,Romance,1,0,0,1,0,0,0,0,1,0,0,0,0,0,0,0,0,0,0,0,ove ill tempered isolated retiree spends days enforcing block association rules visiting wifes grave finally given life unlikely friendship develops boisterous new neighbors,"['Comedy', ' Drama', ' Romance']"
718,What We Do in the Shadows,-2014,R,86 min,"Comedy, Horror",7.7,"1,48,865","1,48,865",Jemaine Clement,"[Taika Waititi, Jemaine Clement, Taika Waititi, Cori Gonzalez-Macuer]","Viago, Deacon and Vladislav are vampires who are finding that modern life has them struggling with the mundane - like paying rent, keeping up with the chore wheel, trying to get into nightclubs and overcoming flatmate conflicts.",Comedy,Horror,None,0,0,0,0,0,0,0,0,1,0,0,0,0,0,0,1,0,0,0,0,viago deacon vladislav vampires finding modern life struggling mundane like paying rent keeping chore wheel trying get nightclubs overcoming flatmate conflicts,"['Comedy', ' Horror']"
719,When Marnie Was There,-2014,PG,103 min,"Animation, Drama, Family",7.7,"30,006","30,006",James Simone,"[Hiromasa Yonebayashi, Sara Takatsuki, Kasumi Arimura, Nanako Matsushima]","Due to 12 y.o. Annas asthma, shes sent to stay with relatives of her guardian in the Japanese countryside. She likes to be alone, sketching. She befriends Marnie. Who is the mysterious, blonde Marnie.",Animation,Drama,Family,1,0,0,0,0,0,1,0,0,0,0,0,0,0,0,0,0,0,0,0,due annas asthma shes sent stay relatives guardian japanese countryside likes alone sketching befriends marnie mysterious blonde marnie,"['Animation', ' Drama', ' Family']"
720,The Theory of Everything,-2014,PG-13,123 min,"Biography, Drama, Romance",7.7,"3,88,379","3,88,379",James Marsh,"[Eddie Redmayne, Felicity Jones, Tom Prior, Sophie Perry]",A look at the relationship between the famous physicist Stephen Hawking and his wife.,Biography,Drama,Romance,1,0,0,1,0,0,0,0,0,0,0,1,0,0,0,0,0,0,0,0,look relationship famous physicist stephen hawking wife,"['Biography', ' Drama', ' Romance']"
721,Kingsman: The Secret Service,-2014,R,129 min,"Action, Adventure, Comedy",7.7,"5,76,998","5,76,998",Matthew Vaughn,"[Colin Firth, Taron Egerton, Samuel L. Jackson, Michael Caine]","A spy organisation recruits a promising street kid into the agencys training program, while a global threat emerges from a twisted tech genius.",Action,Adventure,Comedy,0,0,1,0,0,0,0,0,1,0,0,0,1,0,0,0,0,0,0,0,spy organisation recruits promising street kid agencys training program global threat emerges twisted tech genius,"['Action', ' Adventure', ' Comedy']"
722,The Fault in Our Stars,-2014,PG-13,126 min,"Drama, Romance",7.7,"3,35,312","3,35,312",Josh Boone,"[Shailene Woodley, Ansel Elgort, Nat Wolff, Laura Dern]",Two teenage cancer patients begin a life-affirming journey to visit a reclusive author in Amsterdam.,Drama,Romance,None,1,0,0,1,0,0,0,0,0,0,0,0,0,0,0,0,0,0,0,0,two teenage cancer patients begin life affirming journey visit reclusive author amsterdam,"['Drama', ' Romance']"
723,Me and Earl and the Dying Girl,-2015,PG-13,105 min,"Comedy, Drama",7.7,"1,20,038","1,20,038",Alfonso Gomez-Rejon,"[Thomas Mann, RJ Cyler, Olivia Cooke, Nick Offerman]","High schooler Greg, who spends most of his time making parodies of classic movies with his co-worker Earl, finds his outlook forever altered after befriending a classmate who has just been diagnosed with cancer.",Comedy,Drama,None,1,0,0,0,0,0,0,0,1,0,0,0,0,0,0,0,0,0,0,0,high schooler greg spends time making parodies classic movies co worker earl finds outlook forever altered befriending classmate diagnosed cancer,"['Comedy', ' Drama']"
724,Birdman or (The Unexpected Virtue of Ignorance),-2014,R,119 min,"Comedy, Drama",7.7,"5,63,292","5,63,292",Alejandro G. Iñárritu,"[Michael Keaton, Zach Galifianakis, Edward Norton, Andrea Riseborough]","A washed-up superhero actor attempts to revive his fading career by writing, directing, and starring in a Broadway production.",Comedy,Drama,None,1,0,0,0,0,0,0,0,1,0,0,0,0,0,0,0,0,0,0,0,washed superhero actor attempts revive fading career writing directing starring broadway production,"['Comedy', ' Drama']"
725,Blue Is the Warmest Colour,-2013,NC-17,180 min,"Drama, Romance",7.7,"1,34,575","1,34,575",Abdellatif Kechiche,"[Léa Seydoux, Adèle Exarchopoulos, Salim Kechiouche, Aurélien Recoing]","Adèles life is changed when she meets Emma, a young woman with blue hair, who will allow her to discover desire and to assert herself as a woman and as an adult. In front of others, Adèle grows, seeks herself, loses herself, and ultimately finds herself through love and loss.",Drama,Romance,None,1,0,0,1,0,0,0,0,0,0,0,0,0,0,0,0,0,0,0,0,ad les life changed meets emma young woman blue hair allow discover desire assert woman adult front others ad le grows seeks loses ultimately finds love loss,"['Drama', ' Romance']"
726,Captain America: The Winter Soldier,-2014,PG-13,136 min,"Action, Adventure, SciFi",7.7,"7,15,943","7,15,943",Anthony Russo,"[Joe Russo, Chris Evans, Samuel L. Jackson, Scarlett Johansson]","As Steve Rogers struggles to embrace his role in the modern world, he teams up with a fellow Avenger and S.H.I.E.L.D agent, Black Widow, to battle a new threat from history: an assassin known as the Winter Soldier.",Action,Adventure,SciFi,0,0,1,0,1,0,0,0,0,0,0,0,1,0,0,0,0,0,0,0,steve rogers struggles embrace role modern world teams fellow avenger h e l agent black widow battle new threat history assassin known winter soldier,"['Action', ' Adventure', ' SciFi']"
727,Nebraska,-2013,R,115 min,"Adventure, Comedy, Drama",7.7,"1,10,244","1,10,244",Alexander Payne,"[Bruce Dern, Will Forte, June Squibb, Bob Odenkirk]","An aging, booze-addled father makes the trip from Montana to Nebraska with his estranged son in order to claim a million-dollar Mega Sweepstakes Marketing prize.",Adventure,Comedy,Drama,1,0,1,0,0,0,0,0,1,0,0,0,0,0,0,0,0,0,0,0,aging booze addled father makes trip montana nebraska estranged son order claim million dollar mega sweepstakes marketing prize,"['Adventure', ' Comedy', ' Drama']"
728,Wreck-It Ralph,-2012,PG,101 min,"Animation, Adventure, Comedy",7.7,"3,69,880","3,69,880",Rich Moore,"[John C. Reilly, Jack McBrayer, Jane Lynch, Sarah Silverman]","A video game villain wants to be a hero and sets out to fulfill his dream, but his quest brings havoc to the whole arcade where he lives.",Animation,Adventure,Comedy,0,0,1,0,0,0,0,0,1,0,0,0,0,0,0,0,0,0,0,0,video game villain wants hero sets fulfill dream quest brings havoc whole arcade lives,"['Animation', ' Adventure', ' Comedy']"
729,The Little Prince,-2015,PG,108 min,"Animation, Adventure, Drama",7.7,"54,703","54,703",Mark Osborne,"[Jeff Bridges, Mackenzie Foy, Rachel McAdams, Marion Cotillard]","A little girl lives in a very grown-up world with her mother, who tries to prepare her for it. Her neighbor, the Aviator, introduces the girl to an extraordinary world where anything is possible, the world of the Little Prince.",Animation,Adventure,Drama,1,0,1,0,0,0,0,0,0,0,0,0,0,0,0,0,0,0,0,0,little girl lives grown world mother tries prepare neighbor aviator introduces girl extraordinary world anything possible world little prince,"['Animation', ' Adventure', ' Drama']"
730,Detachment,-2011,Not Rated,98 min,Drama,7.7,"74,377","74,377",Tony Kaye,"[Adrien Brody, Christina Hendricks, Marcia Gay Harden, Lucy Liu]",A substitute teacher who drifts from classroom to classroom finds a connection to the students and teachers during his latest assignment.,Drama,None,None,1,0,0,0,0,0,0,0,0,0,0,0,0,0,0,0,0,0,0,0,substitute teacher drifts classroom classroom finds connection students teachers latest assignment,['Drama']
731,Midnight in Paris,-2011,PG-13,94 min,"Comedy, Fantasy, Romance",7.7,"3,77,873","3,77,873",Woody Allen,"[Owen Wilson, Rachel McAdams, Kathy Bates, Kurt Fuller]","While on a trip to Paris with his fiancées family, a nostalgic screenwriter finds himself mysteriously going back to the 1920s every day at midnight.",Comedy,Fantasy,Romance,0,0,0,1,0,0,0,0,1,0,0,0,0,0,0,0,0,1,0,0,trip paris fianc es family nostalgic screenwriter finds mysteriously going back every day midnight,"['Comedy', ' Fantasy', ' Romance']"
732,A Star Is Born,-2018,R,136 min,"Drama, Music, Romance",7.7,"3,14,704","3,14,704",Bradley Cooper,"[Lady Gaga, Bradley Cooper, Sam Elliott, Greg Grunberg]",A musician helps a young singer find fame as age and alcoholism send his own career into a downward spiral.,Drama,Music,Romance,1,0,0,1,0,0,0,1,0,0,0,0,0,0,0,0,0,0,0,0,musician helps young singer find fame age alcoholism send career downward spiral,"['Drama', ' Music', ' Romance']"
733,The Lego Movie,-2014,PG,100 min,"Animation, Action, Adventure",7.7,"3,18,310","3,18,310",Christopher Miller,"[Phil Lord, Chris Pratt, Will Ferrell, Elizabeth Banks]","An ordinary LEGO construction worker, thought to be the prophesied as ""special"", is recruited to join a quest to stop an evil tyrant from gluing the LEGO universe into eternal stasis.",Animation,Action,Adventure,0,0,1,0,0,0,0,0,0,0,0,0,1,0,0,0,0,0,0,0,ordinary lego construction worker thought prophesied special recruited join quest stop evil tyrant gluing lego universe eternal stasis,"['Animation', ' Action', ' Adventure']"
734,Gravity,-2013,PG-13,91 min,"Drama, SciFi, Thriller",7.7,"7,52,706","7,52,706",Alfonso Cuarón,"[Sandra Bullock, George Clooney, Ed Harris, Orto Ignatiussen]",Two astronauts work together to survive after an accident leaves them stranded in space.,Drama,SciFi,Thriller,1,0,0,0,1,0,0,0,0,0,0,0,0,0,1,0,0,0,0,0,two astronauts work together survive accident leaves stranded space,"['Drama', ' SciFi', ' Thriller']"
735,Star Trek Into Darkness,-2013,PG-13,132 min,"Action, Adventure, SciFi",7.7,"4,57,536","4,57,536",J.J. Abrams,"[Chris Pine, Zachary Quinto, Zoe Saldana, Benedict Cumberbatch]","After the crew of the Enterprise find an unstoppable force of terror from within their own organization, Captain Kirk leads a manhunt to a war-zone world to capture a one-man weapon of mass destruction.",Action,Adventure,SciFi,0,0,1,0,1,0,0,0,0,0,0,0,1,0,0,0,0,0,0,0,crew enterprise find unstoppable force terror within organization captain kirk leads manhunt war zone world capture one man weapon mass destruction,"['Action', ' Adventure', ' SciFi']"
736,Beasts of No Nation,-2015,Not Rated,137 min,"Drama, War",7.7,"71,098","71,098",Cary Joji Fukunaga,"[Abraham Attah, Emmanuel Affadzi, Ricky Adelayitor, Andrew Adote]","A drama based on the experiences of Agu, a child soldier fighting in the civil war of an unnamed African country.",Drama,War,None,1,0,0,0,0,1,0,0,0,0,0,0,0,0,0,0,0,0,0,0,drama based experiences agu child soldier fighting civil war unnamed african country,"['Drama', ' War']"
737,The Social Network,-2010,PG-13,120 min,"Biography, Drama",7.7,"6,05,720","6,05,720",David Fincher,"[Jesse Eisenberg, Andrew Garfield, Justin Timberlake, Rooney Mara]","As Harvard student Mark Zuckerberg creates the social networking site that would become known as Facebook, he is sued by the twins who claimed he stole their idea, and by the co-founder who was later squeezed out of the business.",Biography,Drama,None,1,0,0,0,0,0,0,0,0,0,0,1,0,0,0,0,0,0,0,0,harvard student mark zuckerberg creates social networking site would become known facebook sued twins claimed stole idea co founder later squeezed business,"['Biography', ' Drama']"
738,X-Men: First Class,-2011,PG-13,131 min,"Action, Adventure, SciFi",7.7,"6,35,027","6,35,027",Matthew Vaughn,"[James McAvoy, Michael Fassbender, Jennifer Lawrence, Kevin Bacon]","In the 1960s, superpowered humans Charles Xavier and Erik Lensherr work together to find others like them, but Eriks vengeful pursuit of an ambitious mutant who ruined his life causes a schism to divide them.",Action,Adventure,SciFi,0,0,1,0,1,0,0,0,0,0,0,0,1,0,0,0,0,0,0,0,superpowered humans charles xavier erik lensherr work together find others like eriks vengeful pursuit ambitious mutant ruined life causes schism divide,"['Action', ' Adventure', ' SciFi']"
739,The Hangover,-2009,R,100 min,Comedy,7.7,"7,03,535","7,03,535",Todd Phillips,"[Zach Galifianakis, Bradley Cooper, Justin Bartha, Ed Helms]","Three buddies wake up from a bachelor party in Las Vegas, with no memory of the previous night and the bachelor missing. They make their way around the city in order to find their friend before his wedding.",Comedy,None,None,0,0,0,0,0,0,0,0,1,0,0,0,0,0,0,0,0,0,0,0,three buddies wake bachelor party las vegas memory previous night bachelor missing make way around city order find friend wedding,['Comedy']
740,Skyfall,-2012,PG-13,143 min,"Action, Adventure, Thriller",7.7,"6,18,438","6,18,438",Sam Mendes,"[Daniel Craig, Javier Bardem, Naomie Harris, Judi Dench]","James Bonds loyalty to M is tested when her past comes back to haunt her. When MI6 comes under attack, 007 must track down and destroy the threat, no matter how personal the cost.",Action,Adventure,Thriller,0,0,1,0,0,0,0,0,0,0,0,0,1,0,1,0,0,0,0,0,james bonds loyalty tested past comes back haunt mi comes attack must track destroy threat matter personal cost,"['Action', ' Adventure', ' Thriller']"
741,Silver Linings Playbook,-2012,R,122 min,"Comedy, Drama, Romance",7.7,"6,49,065","6,49,065",David O. Russell,"[Bradley Cooper, Jennifer Lawrence, Robert De Niro, Jacki Weaver]","After a stint in a mental institution, former teacher Pat Solitano moves back in with his parents and tries to reconcile with his ex-wife. Things get more challenging when Pat meets Tiffany, a mysterious girl with problems of her own.",Comedy,Drama,Romance,1,0,0,1,0,0,0,0,1,0,0,0,0,0,0,0,0,0,0,0,stint mental institution former teacher pat solitano moves back parents tries reconcile ex wife things get challenging pat meets tiffany mysterious girl problems,"['Comedy', ' Drama', ' Romance']"
742,Argo,-2012,R,120 min,"Biography, Drama, Thriller",7.7,"5,61,272","5,61,272",Ben Affleck,"[Ben Affleck, Bryan Cranston, John Goodman, Alan Arkin]","Acting under the cover of a Hollywood producer scouting a location for a science fiction film, a CIA agent launches a dangerous operation to rescue six Americans in Tehran during the U.S. hostage crisis in Iran in 1979.",Biography,Drama,Thriller,1,0,0,0,0,0,0,0,0,0,0,1,0,0,1,0,0,0,0,0,acting cover hollywood producer scouting location science fiction film cia agent launches dangerous operation rescue six americans tehran u hostage crisis iran,"['Biography', ' Drama', ' Thriller']"
743,500 Days of Summer,-2009,PG-13,95 min,"Comedy, Drama, Romance",7.7,"4,62,605","4,62,605",Marc Webb,"[Zooey Deschanel, Joseph Gordon-Levitt, Geoffrey Arend, Chloë Grace Moretz]","An offbeat romantic comedy about a woman who doesnt believe true love exists, and the young man who falls for her.",Comedy,Drama,Romance,1,0,0,1,0,0,0,0,1,0,0,0,0,0,0,0,0,0,0,0,offbeat romantic comedy woman doesnt believe true love exists young man falls,"['Comedy', ' Drama', ' Romance']"
744,Harry Potter and the Deathly Hallows: Part 1,-2010,PG-13,146 min,"Adventure, Family, Fantasy",7.7,"4,60,406","4,60,406",David Yates,"[Daniel Radcliffe, Emma Watson, Rupert Grint, Bill Nighy]","As Harry (Daniel Radcliffe), Ron (Rupert Grint), and Hermione (Emma Watson) race against time and evil to destroy the Horcruxes, they uncover the existence of the three most powerful objects in the wizarding world: the Deathly Hallows.",Adventure,Family,Fantasy,0,0,1,0,0,0,1,0,0,0,0,0,0,0,0,0,0,1,0,0,harry daniel radcliffe ron rupert grint hermione emma watson race time evil destroy horcruxes uncover existence three powerful objects wizarding world deathly hallows,"['Adventure', ' Family', ' Fantasy']"
745,Ponyo,-2008,G,101 min,"Animation, Adventure, Comedy",7.7,"1,19,015","1,19,015",Hayao Miyazaki,"[Cate Blanchett, Matt Damon, Liam Neeson, Tomoko Yamaguchi]","A five-year-old boy develops a relationship with Ponyo, a young goldfish princess who longs to become a human after falling in love with him.",Animation,Adventure,Comedy,0,0,1,0,0,0,0,0,1,0,0,0,0,0,0,0,0,0,0,0,five year old boy develops relationship ponyo young goldfish princess longs become human falling love,"['Animation', ' Adventure', ' Comedy']"
746,Frost/Nixon,-2008,R,122 min,"Biography, Drama, History",7.7,"1,01,033","1,01,033",Ron Howard,"[Frank Langella, Michael Sheen, Kevin Bacon, Sam Rockwell]",A dramatic retelling of the post-Watergate television interviews between British talk-show host David Frost and former president Richard Nixon.,Biography,Drama,History,1,0,0,0,0,0,0,0,0,0,0,1,0,0,0,0,0,0,0,1,dramatic retelling post watergate television interviews british talk show host david frost former president richard nixon,"['Biography', ' Drama', ' History']"
747,Paprika,-2006,R,90 min,"Animation, Drama, Fantasy",7.7,"67,782","67,782",Satoshi Kon,"[Megumi Hayashibara, Tôru Emori, Katsunosuke Hori, Tôru Furuya]","When a machine that allows therapists to enter their patients dreams is stolen, all Hell breaks loose. Only a young female therapist, Paprika, can stop it.",Animation,Drama,Fantasy,1,0,0,0,0,0,0,0,0,0,0,0,0,0,0,0,0,1,0,0,machine allows therapists enter patients dreams stolen hell breaks loose young female therapist paprika stop,"['Animation', ' Drama', ' Fantasy']"
748,Changeling,-2008,R,141 min,"Biography, Crime, Drama",7.7,"2,32,556","2,32,556",Clint Eastwood,"[Angelina Jolie, Colm Feore, Amy Ryan, Gattlin Griffith]",Grief-stricken mother Christine Collins (Angelina Jolie) takes on the L.A.P.D. to her own detriment when it tries to pass off an obvious impostor as her missing child.,Biography,Crime,Drama,1,1,0,0,0,0,0,0,0,0,0,1,0,0,0,0,0,0,0,0,grief stricken mother christine collins angelina jolie takes l p detriment tries pass obvious impostor missing child,"['Biography', ' Crime', ' Drama']"
