,Title,Description
0,Dil Bechara,"The emotional journey of two hopelessly in love youngsters, a young girl, Kizie, suffering from cancer, and a boy, Manny, who she meets at a support group."
1,The Shawshank Redemption,"Two imprisoned men bond over a number of years, finding solace and eventual redemption through acts of common decency."
2,The Godfather,The aging patriarch of an organized crime dynasty transfers control of his clandestine empire to his reluctant son.
3,The Dark Knight,"When the menace known as the Joker wreaks havoc and chaos on the people of Gotham, Batman must accept one of the greatest psychological and physical tests of his ability to fight injustice."
4,The Godfather: Part II,"The early life and career of Vito Corleone in 1920s New York City is portrayed, while his son, Michael, expands and tightens his grip on the family crime syndicate."
5,Hamilton,"The real life of one of America's foremost founding fathers and first Secretary of the Treasury, Alexander Hamilton. Captured live on Broadway from the Richard Rodgers Theater with the original Broadway cast."
6,The Lord of the Rings: The Return of the King,Gandalf and Aragorn lead the World of Men against Sauron's army to draw his gaze from Frodo and Sam as they approach Mount Doom with the One Ring.
7,Pulp Fiction,"The lives of two mob hitmen, a boxer, a gangster and his wife, and a pair of diner bandits intertwine in four tales of violence and redemption."
8,Schindler's List,"In German-occupied Poland during World War II, industrialist Oskar Schindler gradually becomes concerned for his Jewish workforce after witnessing their persecution by the Nazis."
9,12 Angry Men,A jury holdout attempts to prevent a miscarriage of justice by forcing his colleagues to reconsider the evidence.
10,Inception,A thief who steals corporate secrets through the use of dream-sharing technology is given the inverse task of planting an idea into the mind of a C.E.O.
11,Fight Club,"An insomniac office worker and a devil-may-care soapmaker form an underground fight club that evolves into something much, much more."
12,The Lord of the Rings: The Fellowship of the Ring,A meek Hobbit from the Shire and eight companions set out on a journey to destroy the powerful One Ring and save Middle-earth from the Dark Lord Sauron.
13,Forrest Gump,"The presidencies of Kennedy and Johnson, the events of Vietnam, Watergate and other historical events unfold through the perspective of an Alabama man with an IQ of 75, whose only desire is to be reunited with his childhood sweetheart."
14,"Il buono, il brutto, il cattivo",A bounty hunting scam joins two men in an uneasy alliance against a third in a race to find a fortune in gold buried in a remote cemetery.
15,The Lord of the Rings: The Two Towers,"While Frodo and Sam edge closer to Mordor with the help of the shifty Gollum, the divided fellowship makes a stand against Sauron's new ally, Saruman, and his hordes of Isengard."
16,The Matrix,A computer hacker learns from mysterious rebels about the true nature of his reality and his role in the war against its controllers.
17,Goodfellas,"The story of Henry Hill and his life in the mob, covering his relationship with his wife Karen Hill and his mob partners Jimmy Conway and Tommy DeVito in the Italian-American crime syndicate."
18,Star Wars: Episode V - The Empire Strikes Back,"After the Rebels are brutally overpowered by the Empire on the ice planet Hoth, Luke Skywalker begins Jedi training with Yoda, while his friends are pursued by Darth Vader and a bounty hunter named Boba Fett all over the galaxy."
19,One Flew Over the Cuckoo's Nest,"A criminal pleads insanity and is admitted to a mental institution, where he rebels against the oppressive nurse and rallies up the scared patients."
20,Seppuku,"When a ronin requesting seppuku at a feudal lord's palace is told of the brutal suicide of another ronin who previously visited, he reveals how their pasts are intertwined - and in doing so challenges the clan's integrity."
21,Gisaengchung,Greed and class discrimination threaten the newly formed symbiotic relationship between the wealthy Park family and the destitute Kim clan.
22,Interstellar,A team of explorers travel through a wormhole in space in an attempt to ensure humanity's survival.
23,Cidade de Deus,"In the slums of Rio, two kids' paths diverge as one struggles to become a photographer and the other a kingpin."
24,Sen to Chihiro no kamikakushi,"During her family's move to the suburbs, a sullen 10-year-old girl wanders into a world ruled by gods, witches, and spirits, and where humans are changed into beasts."
25,Saving Private Ryan,"Following the Normandy Landings, a group of U.S. soldiers go behind enemy lines to retrieve a paratrooper whose brothers have been killed in action."
26,The Green Mile,"The lives of guards on Death Row are affected by one of their charges: a black man accused of child murder and rape, yet who has a mysterious gift."
27,La vita è bella,"When an open-minded Jewish librarian and his son become victims of the Holocaust, he uses a perfect mixture of will, humor, and imagination to protect his son from the dangers around their camp."
28,Se7en,"Two detectives, a rookie and a veteran, hunt a serial killer who uses the seven deadly sins as his motives."
29,The Silence of the Lambs,"A young F.B.I. cadet must receive the help of an incarcerated and manipulative cannibal killer to help catch another serial killer, a madman who skins his victims."
30,Star Wars,"Luke Skywalker joins forces with a Jedi Knight, a cocky pilot, a Wookiee and two droids to save the galaxy from the Empire's world-destroying battle station, while also attempting to rescue Princess Leia from the mysterious Darth Vader."
31,Shichinin no samurai,A poor village under attack by bandits recruits seven unemployed samurai to help them defend themselves.
32,It's a Wonderful Life,An angel is sent from Heaven to help a desperately frustrated businessman by showing him what life would have been like if he had never existed.
33,Joker,"In Gotham City, mentally troubled comedian Arthur Fleck is disregarded and mistreated by society. He then embarks on a downward spiral of revolution and bloody crime. This path brings him face-to-face with his alter-ego: the Joker."
34,Ayla: The Daughter of War,"In 1950, amid-st the ravages of the Korean War, Sergeant Süleyman stumbles upon a half-frozen little girl, with no parents and no help in sight. Frantic, scared and on the verge of death, ...                See full summary »
"
35,Whiplash,A promising young drummer enrolls at a cut-throat music conservatory where his dreams of greatness are mentored by an instructor who will stop at nothing to realize a student's potential.
36,The Intouchables,"After he becomes a quadriplegic from a paragliding accident, an aristocrat hires a young man from the projects to be his caregiver."
37,The Prestige,"After a tragic accident, two stage magicians engage in a battle to create the ultimate illusion while sacrificing everything they have to outwit each other."
38,The Departed,An undercover cop and a mole in the police attempt to identify each other while infiltrating an Irish gang in South Boston.
39,The Pianist,A Polish Jewish musician struggles to survive the destruction of the Warsaw ghetto of World War II.
40,Gladiator,A former Roman General sets out to exact vengeance against the corrupt emperor who murdered his family and sent him into slavery.
41,American History X,A former neo-nazi skinhead tries to prevent his younger brother from going down the same wrong path that he did.
42,The Usual Suspects,"A sole survivor tells of the twisty events leading up to a horrific gun battle on a boat, which began when five criminals met at a seemingly random police lineup."
43,Léon,"Mathilda, a 12-year-old girl, is reluctantly taken in by Léon, a professional assassin, after her family is murdered. An unusual relationship forms as she becomes his protégée and learns the assassin's trade."
44,The Lion King,"Lion prince Simba and his father are targeted by his bitter uncle, who wants to ascend the throne himself."
45,Terminator 2: Judgment Day,"A cyborg, identical to the one who failed to kill Sarah Connor, must now protect her teenage son, John Connor, from a more advanced and powerful cyborg."
46,Nuovo Cinema Paradiso,A filmmaker recalls his childhood when falling in love with the pictures at the cinema of his home village and forms a deep friendship with the cinema's projectionist.
47,Hotaru no haka,A young boy and his little sister struggle to survive in Japan during World War II.
48,Back to the Future,"Marty McFly, a 17-year-old high school student, is accidentally sent thirty years into the past in a time-traveling DeLorean invented by his close friend, the eccentric scientist Doc Brown."
49,Anand,"The story of a terminally ill man who wishes to live life to the fullest before the inevitable occurs, as told by his best friend."
50,Once Upon a Time in the West,A mysterious stranger with a harmonica joins forces with a notorious desperado to protect a beautiful widow from a ruthless assassin working for the railroad.
51,Psycho,"A Phoenix secretary embezzles forty thousand dollars from her employer's client, goes on the run, and checks into a remote motel run by a young man under the domination of his mother."
52,Casablanca,A cynical American expatriate struggles to decide whether or not he should help his former lover and her fugitive husband escape French Morocco.
53,Modern Times,The Tramp struggles to live in modern industrial society with the help of a young homeless woman.
54,City Lights,"With the aid of a wealthy erratic tippler, a dewy-eyed tramp who has fallen in love with a sightless flower girl accumulates money to be able to help her medically."
55,Capharnaüm,"While serving a five-year sentence for a violent crime, a 12-year-old boy sues his parents for neglect."
56,Kimi no na wa.,"Two strangers find themselves linked in a bizarre way. When a connection forms, will distance be the only thing to keep them apart?"
57,Dangal,Former wrestler Mahavir Singh Phogat and his two wrestler daughters struggle towards glory at the Commonwealth Games in the face of societal oppression.
58,Spider-Man: Into the Spider-Verse,"Teen Miles Morales becomes the Spider-Man of his universe, and must join with five spider-powered individuals from other dimensions to stop a threat for all realities."
59,Avengers: Endgame,"After the devastating events of Avengers: Infinity War (2018), the universe is in ruins. With the help of remaining allies, the Avengers assemble once more in order to reverse Thanos' actions and restore balance to the universe."
60,Avengers: Infinity War,The Avengers and their allies must be willing to sacrifice all in an attempt to defeat the powerful Thanos before his blitz of devastation and ruin puts an end to the universe.
61,Drishyam,A man goes to extreme lengths to save his family from punishment after the family commits an accidental crime.
62,Coco,"Aspiring musician Miguel, confronted with his family's ancestral ban on music, enters the Land of the Dead to find his great-great-grandfather, a legendary singer."
63,Django Unchained,"With the help of a German bounty hunter, a freed slave sets out to rescue his wife from a brutal Mississippi plantation owner."
64,The Dark Knight Rises,"Eight years after the Joker's reign of anarchy, Batman, with the help of the enigmatic Catwoman, is forced from his exile to save Gotham City from the brutal guerrilla terrorist Bane."
65,3 Idiots,"Two friends are searching for their long lost companion. They revisit their college days and recall the memories of their friend who inspired them to think differently, even as the rest of the world called them ""idiots""."
66,Taare Zameen Par,"An eight-year-old boy is thought to be a lazy trouble-maker, until the new art teacher has the patience and compassion to discover the real problem behind his struggles in school."
67,WALL·E,"In the distant future, a small waste-collecting robot inadvertently embarks on a space journey that will ultimately decide the fate of mankind."
68,The Lives of Others,"In 1984 East Berlin, an agent of the secret police, conducting surveillance on a writer and his lover, finds himself becoming increasingly absorbed by their lives."
69,Oldeuboi,"After being kidnapped and imprisoned for fifteen years, Oh Dae-Su is released, only to find that he must find his captor in five days."
70,Memento,A man with short-term memory loss attempts to track down his wife's murderer.
71,Mononoke-hime,"On a journey to find the cure for a Tatarigami's curse, Ashitaka finds himself in the middle of a war between the forest gods and Tatara, a mining colony. In this quest he also meets San, the Mononoke Hime."
72,Once Upon a Time in America,"A former Prohibition-era Jewish gangster returns to the Lower East Side of Manhattan over thirty years later, where he once again must confront the ghosts and regrets of his old life."
73,Raiders of the Lost Ark,"In 1936, archaeologist and adventurer Indiana Jones is hired by the U.S. government to find the Ark of the Covenant before Adolf Hitler's Nazis can obtain its awesome powers."
74,The Shining,"A family heads to an isolated hotel for the winter where a sinister presence influences the father into violence, while his psychic son sees horrific forebodings from both past and future."
75,Apocalypse Now,A U.S. Army officer serving in Vietnam is tasked with assassinating a renegade Special Forces Colonel who sees himself as a god.
76,Alien,"After a space merchant vessel receives an unknown transmission as a distress call, one of the crew is attacked by a mysterious life form and they soon realize that its life cycle has merely begun."
77,Tengoku to jigoku,An executive of a shoe company becomes a victim of extortion when his chauffeur's son is kidnapped and held for ransom.
78,Dr. Strangelove or: How I Learned to Stop Worrying and Love the Bomb,An insane general triggers a path to nuclear holocaust that a War Room full of politicians and generals frantically tries to stop.
79,Witness for the Prosecution,A veteran British barrister must defend his client in a murder trial that has surprise after surprise.
80,Paths of Glory,"After refusing to attack an enemy position, a general accuses the soldiers of cowardice and their commanding officer must defend them."
81,Rear Window,A wheelchair-bound photographer spies on his neighbors from his apartment window and becomes convinced one of them has committed murder.
82,Sunset Blvd.,A screenwriter develops a dangerous relationship with a faded film star determined to make a triumphant return.
83,The Great Dictator,Dictator Adenoid Hynkel tries to expand his empire while a poor Jewish barber tries to avoid persecution from Hynkel's regime.
84,1917,"April 6th, 1917. As a regiment assembles to wage war deep in enemy territory, two soldiers are assigned to race against time and deliver a message that will stop 1,600 men from walking straight into a deadly trap."
85,Uri: The Surgical Strike,"Indian army special forces execute a covert operation, avenging the killing of fellow army men at their base by a terrorist group."
86,Andhadhun,"A series of mysterious events change the life of a blind pianist, who must now report a crime that he should technically know nothing of."
87,Jagten,"A teacher lives a lonely life, all the while struggling over his son's custody. His life slowly gets better as he finds love and receives good news from his son, but his new luck is about to be brutally shattered by an innocent little lie."
88,Jodaeiye Nader az Simin,A married couple are faced with a difficult decision - to improve the life of their child by moving to another country or to stay in Iran and look after a deteriorating parent who has Alzheimer's disease.
89,Incendies,Twins journey to the Middle East to discover their family history and fulfill their mother's last wishes.
90,Yedinci Kogustaki Mucize,A story of love between a mentally-ill father who was wrongly accused of murder and his lovely six years old daughter. The prison would be their home. Based on the 2013 Korean movie 7-beon-bang-ui seon-mul (2013).
91,Babam ve Oglum,The family of a left-wing journalist is torn apart after the military coup of Turkey in 1980.
92,Toy Story 3,"The toys are mistakenly delivered to a day-care center instead of the attic right before Andy leaves for college, and it's up to Woody to convince the other toys that they weren't abandoned and to return home."
93,Inglourious Basterds,"In Nazi-occupied France during World War II, a plan to assassinate Nazi leaders by a group of Jewish U.S. soldiers coincides with a theatre owner's vengeful plans for the same."
94,Eternal Sunshine of the Spotless Mind,"When their relationship turns sour, a couple undergoes a medical procedure to have each other erased from their memories."
95,Amélie,"Amélie is an innocent and naive girl in Paris with her own sense of justice. She decides to help those around her and, along the way, discovers love."
96,Snatch,"Unscrupulous boxing promoters, violent bookmakers, a Russian gangster, incompetent amateur robbers and supposedly Jewish jewelers fight to track down a priceless stolen diamond."
97,Requiem for a Dream,The drug-induced utopias of four Coney Island people are shattered when their addictions run deep.
98,American Beauty,A sexually frustrated suburban father has a mid-life crisis after becoming infatuated with his daughter's best friend.
99,Good Will Hunting,"Will Hunting, a janitor at M.I.T., has a gift for mathematics, but needs help from a psychologist to find direction in his life."
100,Bacheha-Ye aseman,"After a boy loses his sister's pair of shoes, he goes on a series of adventures in order to find them. When he can't, he tries a new way to ""win"" a new pair."
101,Eskiya,"Baran the Bandit, released from prison after 35 years, searches for vengeance and his lover."
102,Toy Story,A cowboy doll is profoundly threatened and jealous when a new spaceman figure supplants him as top toy in a boy's room.
103,Braveheart,"When his secret bride is executed for assaulting an English soldier who tried to rape her, William Wallace begins a revolt against King Edward I of England."
104,Reservoir Dogs,"When a simple jewelry heist goes horribly wrong, the surviving criminals begin to suspect that one of them is a police informant."
105,Full Metal Jacket,A pragmatic U.S. Marine observes the dehumanizing effects the Vietnam War has on his fellow recruits from their brutal boot camp training to the bloody street fighting in Hue.
106,Idi i smotri,"After finding an old rifle, a young boy joins the Soviet resistance movement against ruthless German forces and experiences the horrors of World War II."
107,Aliens,"Ellen Ripley is rescued by a deep salvage team after being in hypersleep for 57 years. The moon that the Nostromo visited has been colonized, but contact is lost. This time, colonial marines have impressive firepower, but will that be enough?"
108,Amadeus,"The life, success and troubles of Wolfgang Amadeus Mozart, as told by Antonio Salieri, the contemporaneous composer who was insanely jealous of Mozart's talent and claimed to have murdered him."
109,Scarface,"In 1980 Miami, a determined Cuban immigrant takes over a drug cartel and succumbs to greed."
110,Star Wars: Episode VI - Return of the Jedi,"After a daring mission to rescue Han Solo from Jabba the Hutt, the Rebels dispatch to Endor to destroy the second Death Star. Meanwhile, Luke struggles to help Darth Vader back from the dark side without falling into the Emperor's trap."
111,Das Boot,"The claustrophobic world of a WWII German U-boat; boredom, filth and sheer terror."
112,Taxi Driver,"A mentally unstable veteran works as a nighttime taxi driver in New York City, where the perceived decadence and sleaze fuels his urge for violent action by attempting to liberate a presidential campaign worker and an underage prostitute."
113,The Sting,Two grifters team up to pull off the ultimate con.
114,A Clockwork Orange,"In the future, a sadistic gang leader is imprisoned and volunteers for a conduct-aversion experiment, but it doesn't go as planned."
115,2001: A Space Odyssey,"After discovering a mysterious artifact buried beneath the Lunar surface, mankind sets off on a quest to find its origins with help from intelligent supercomputer H.A.L. 9000."
116,Per qualche dollaro in più,Two bounty hunters with the same intentions team up to track down a Western outlaw.
117,Lawrence of Arabia,"The story of T.E. Lawrence, the English officer who successfully united and led the diverse, often warring, Arab tribes during World War I in order to fight the Turks."
118,The Apartment,"A man tries to rise in his company by letting its executives use his apartment for trysts, but complications and a romance of his own ensue."
119,North by Northwest,A New York City advertising executive goes on the run after being mistaken for a government agent by a group of foreign spies.
120,Vertigo,A former police detective juggles wrestling with his personal demons and becoming obsessed with a hauntingly beautiful woman.
121,Singin' in the Rain,A silent film production company and cast make a difficult transition to sound.
122,Ikiru,A bureaucrat tries to find a meaning in his life after he discovers he has terminal cancer.
123,Ladri di biciclette,"In post-war Italy, a working-class man's bicycle is stolen. He and his son set out to find it."
124,Double Indemnity,An insurance representative lets himself be talked by a seductive housewife into a murder/insurance fraud scheme that arouses the suspicion of an insurance investigator.
125,Citizen Kane,"Following the death of publishing tycoon Charles Foster Kane, reporters scramble to uncover the meaning of his final utterance; 'Rosebud'."
126,M - Eine Stadt sucht einen Mörder,"When the police in a German city are unable to catch a child-murderer, other criminals join in the manhunt."
127,Metropolis,"In a futuristic city sharply divided between the working class and the city planners, the son of the city's mastermind falls in love with a working class prophet who predicts the coming of a savior to mediate their differences."
128,The Kid,"The Tramp cares for an abandoned child, but events put that relationship in jeopardy."
129,K.G.F: Chapter 1,"In the 1970s, a fierce rebel rises against brutal oppression and becomes the symbol of hope to legions of downtrodden people."
130,Green Book,A working-class Italian-American bouncer becomes the driver of an African-American classical pianist on a tour of venues through the 1960s American South.
131,Koe no katachi,"A young man is ostracized by his classmates after he bullies a deaf girl to the point where she moves away. Years later, he sets off on a path for redemption."
132,"Three Billboards Outside Ebbing, Missouri",A mother personally challenges the local authorities to solve her daughter's murder when they fail to catch the culprit.
133,Talvar,An experienced investigator confronts several conflicting theories about the perpetrators of a violent double homicide.
134,Baahubali 2: The Conclusion,"When Shiva, the son of Bahubali, learns about his heritage, he begins to look for answers. His story is juxtaposed with past events that unfolded in the Mahishmati Kingdom."
135,Klaus,"A simple act of kindness always sparks another, even in a frozen, faraway place. When Smeerensburg's new postman, Jesper, befriends toymaker Klaus, their gifts melt an age-old feud and deliver a sleigh full of holiday traditions."
136,Drishyam,"Desperate measures are taken by a man who tries to save his family from the dark side of the law, after they commit an unexpected crime."
137,Queen,A Delhi girl from a traditional family sets out on a solo honeymoon after her marriage gets cancelled.
138,Mandariinid,"In 1992, war rages in Abkhazia, a breakaway region of Georgia. An Estonian man Ivo has decided to stay behind and harvest his crops of tangerines. In a bloody conflict at his door, a wounded man is left behind, and Ivo takes him in."
139,Bhaag Milkha Bhaag,The truth behind the ascension of Milkha Singh who was scarred because of the India-Pakistan partition.
140,Gangs of Wasseypur,"A clash between Sultan and Shahid Khan leads to the expulsion of Khan from Wasseypur, and ignites a deadly blood feud spanning three generations."
141,Udaan,"Expelled from his school, a 16-year old boy returns home to his abusive and oppressive father."
142,Paan Singh Tomar,"The story of Paan Singh Tomar, an Indian athlete and seven-time national steeplechase champion who becomes one of the most feared dacoits in Chambal Valley after his retirement."
143,El secreto de sus ojos,A retired legal counselor writes a novel hoping to find closure for one of his past unresolved homicide cases and for his unreciprocated love with his superior - both of which still haunt him decades later.
144,Warrior,"The youngest son of an alcoholic former boxer returns home, where he's trained by his father for competition in a mixed martial arts tournament - a path that puts the fighter on a collision course with his estranged, older brother."
145,Shutter Island,"In 1954, a U.S. Marshal investigates the disappearance of a murderer who escaped from a hospital for the criminally insane."
146,Up,"78-year-old Carl Fredricksen travels to Paradise Falls in his house equipped with balloons, inadvertently taking a young stowaway."
147,The Wolf of Wall Street,"Based on the true story of Jordan Belfort, from his rise to a wealthy stock-broker living the high life to his fall involving crime, corruption and the federal government."
148,Chak De! India,Kabir Khan is the coach of the Indian Women's National Hockey Team and his dream is to make his all girls team emerge victorious against all odds.
