,Title,Description
149,There Will Be Blood,"A story of family, religion, hatred, oil and madness, focusing on a turn-of-the-century prospector in the early days of the business."
150,Pan's Labyrinth,"In the Falangist Spain of 1944, the bookish young stepdaughter of a sadistic army officer escapes into an eerie but captivating fantasy world."
151,V for Vendetta,"In a future British tyranny, a shadowy freedom fighter, known only by the alias of ""V"", plots to overthrow it with the help of a young woman."
152,Rang De Basanti,"The story of six young Indians who assist an English woman to film a documentary on the freedom fighters from their past, and the events that lead them to relive the long-forgotten saga of freedom."
153,Black,"The cathartic tale of a young woman who can't see, hear or talk and the teacher who brings a ray of light into her dark world."
154,Batman Begins,"After training with his mentor, Batman begins his fight to free crime-ridden Gotham City from corruption."
155,"Swades: We, the People",A successful Indian scientist returns to an Indian village to take his nanny to America with him and in the process rediscovers his roots.
156,Der Untergang,"Traudl Junge, the final secretary for Adolf Hitler, tells of the Nazi dictator's final days in his Berlin bunker at the end of WWII."
157,Hauru no ugoku shiro,"When an unconfident young woman is cursed with an old body by a spiteful witch, her only chance of breaking the spell lies with a self-indulgent yet insecure young wizard and his companions in his legged, walking castle."
158,A Beautiful Mind,"After John Nash, a brilliant but asocial mathematician, accepts secret work in cryptography, his life takes a turn for the nightmarish."
159,Hera Pheri,"Three unemployed men look for answers to all their money problems - but when their opportunity arrives, will they know what to do with it?"
160,"Lock, Stock and Two Smoking Barrels","A botched card game in London triggers four friends, thugs, weed-growers, hard gangsters, loan sharks and debt collectors to collide with each other in a series of unexpected events, all for the sake of weed, cash and two antique shotguns."
161,L.A. Confidential,"As corruption grows in 1950s Los Angeles, three policemen - one strait-laced, one brutal, and one sleazy - investigate a series of murders with their own brand of justice."
162,Heat,A group of professional bank robbers start to feel the heat from police when they unknowingly leave a clue at their latest heist.
163,Casino,"A tale of greed, deception, money, power, and murder occur between two best friends: a mafia enforcer and a casino executive, compete against each other over a gambling empire, and over a fast living and fast loving socialite."
164,Andaz Apna Apna,Two slackers competing for the affections of an heiress inadvertently become her protectors from an evil criminal.
165,Unforgiven,"Retired Old West gunslinger William Munny (Clint Eastwood) reluctantly takes on one last job, with the help of his old partner Ned Logan (Morgan Freeman) and a young man, The ""Schofield Kid"" (Jaimz Woolvett)."
166,Indiana Jones and the Last Crusade,"In 1938, after his father Professor Henry Jones, Sr. goes missing while pursuing the Holy Grail, Professor Henry ""Indiana"" Jones, Jr. finds himself up against Adolf Hitler's Nazis again to stop them from obtaining its powers."
167,Tonari no Totoro,"When two girls move to the country to be near their ailing mother, they have adventures with the wondrous forest spirits who live nearby."
168,Die Hard,An NYPD officer tries to save his wife and several others taken hostage by German terrorists during a Christmas party at the Nakatomi Plaza in Los Angeles.
169,Ran,"In Medieval Japan, an elderly warlord retires, handing over his empire to his three sons. However, he vastly underestimates how the new-found power will corrupt them and cause them to turn on each other...and him."
170,Raging Bull,"The life of boxer Jake LaMotta, whose violence and temper that led him to the top in the ring destroyed his life outside of it."
171,Stalker,A guide leads two men through an area known as the Zone to find a room that grants wishes.
172,The Message,This epic historical drama chronicles the life and times of Prophet Muhammad and serves as an introduction to early Islamic history.
173,Sholay,"After his family is murdered by a notorious and ruthless bandit, a former police officer enlists the services of two outlaws to capture the bandit."
174,Monty Python and the Holy Grail,"King Arthur (Graham Chapman) and his Knights of the Round Table embark on a surreal, low-budget search for the Holy Grail, encountering many, very silly obstacles."
175,Chinatown,"A private detective hired to expose an adulterer finds himself caught up in a web of deceit, corruption, and murder."
176,The Great Escape,Allied prisoners of war plan for several hundred of their number to escape from a German camp during World War II.
177,To Kill a Mockingbird,"Atticus Finch, a lawyer in the Depression-era South, defends a black man against an undeserved rape charge, and his children against prejudice."
178,Yôjinbô,A crafty ronin comes to a town divided by two criminal gangs and decides to play them against each other to free the town.
179,Judgment at Nuremberg,"In 1948, an American court in occupied Germany tries four Nazis judged for war crimes."
180,Some Like It Hot,"After two male musicians witness a mob hit, they flee the state in an all-female band disguised as women, but further complications set in."
181,Smultronstället,"After living a life marked by coldness, an aging professor is forced to confront the emptiness of his existence."
182,Det sjunde inseglet,"A man seeks answers about life, death, and the existence of God as he plays chess against the Grim Reaper during the Black Plague."
183,Du rififi chez les hommes,"Four men plan a technically perfect crime, but the human element intervenes..."
184,Dial M for Murder,A tennis player tries to arrange his wife's murder after learning of her affair.
185,Tôkyô monogatari,"An old couple visit their children and grandchildren in the city, but receive little attention."
186,Rashômon,"The rape of a bride and the murder of her samurai husband are recalled from the perspectives of a bandit, the bride, the samurai's ghost and a woodcutter."
187,All About Eve,A seemingly timid but secretly ruthless ingénue insinuates herself into the lives of an aging Broadway star and her circle of theater friends.
188,The Treasure of the Sierra Madre,Two Americans searching for work in Mexico convince an old prospector to help them mine for gold in the Sierra Madre Mountains.
189,To Be or Not to Be,"During the Nazi occupation of Poland, an acting troupe becomes embroiled in a Polish soldier's efforts to track down a German spy."
190,The Circus,The Tramp finds work and the girl of his dreams at a circus.
191,The Gold Rush,A prospector goes to the Klondike in search of gold and finds it and more.
192,Sherlock Jr.,"A film projectionist longs to be a detective, and puts his meagre skills to work when he is framed by a rival for stealing his girlfriend's father's pocketwatch."
193,Portrait de la jeune fille en feu,"On an isolated island in Brittany at the end of the eighteenth century, a female painter is obliged to paint a wedding portrait of a young woman."
194,Pink,"When three young women are implicated in a crime, a retired lawyer steps forward to help them clear their names."
195,Contratiempo,A successful entrepreneur accused of murder and a witness preparation expert have less than three hours to come up with an impregnable defence.
196,Ah-ga-ssi,"A woman is hired as a handmaiden to a Japanese heiress, but secretly she is involved in a plot to defraud her."
197,Mommy,"A widowed single mother, raising her violent son alone, finds new hope when a mysterious neighbor inserts herself into their household."
198,Haider,"A young man returns to Kashmir after his father's disappearance to confront his uncle, whom he suspects of playing a role in his father's fate."
199,Logan,"In a future where mutants are nearly extinct, an elderly and weary Logan leads a quiet life. But when Laura, a mutant child pursued by scientists, comes to him for help, he must get her to safety."
200,Room,"Held captive for 7 years in an enclosed space, a woman and her young son finally gain their freedom, allowing the boy to experience the outside world for the first time."
201,Relatos salvajes,Six short stories that explore the extremities of human behavior involving people in distress.
202,Kis Uykusu,A hotel owner and landlord in a remote Turkish village deals with conflicts within his family and a tenant behind on his rent.
203,Bãhubali: The Beginning,"In ancient India, an adventurous and daring man becomes involved in a decades old feud between two warring people."
204,Gully Boy,A coming-of-age story based on the lives of street rappers in Mumbai.
205,PK,An alien on Earth loses the only device he can use to communicate with his spaceship. His innocent nature and child-like questions force the country to evaluate the impact of religion on its people.
206,OMG: Oh My God!,A shopkeeper takes God to court when his shop is destroyed by an earthquake.
207,The Grand Budapest Hotel,"A writer encounters the owner of an aging high-class hotel, who tells him of his early years serving as a lobby boy in the hotel's glorious years under an exceptional concierge."
208,Gone Girl,"With his wife's disappearance having become the focus of an intense media circus, a man sees the spotlight turned on him when it's suspected that he may not be innocent."
209,Ookami kodomo no Ame to Yuki,"After her werewolf lover unexpectedly dies in an accident while hunting for food for their children, a young woman must find ways to raise the werewolf son and daughter that she had with him while keeping their trait hidden from society."
210,Hacksaw Ridge,"World War II American Army Medic Desmond T. Doss, who served during the Battle of Okinawa, refuses to kill people, and becomes the first man in American history to receive the Medal of Honor without firing a shot."
211,Inside Out,"After young Riley is uprooted from her Midwest life and moved to San Francisco, her emotions - Joy, Fear, Anger, Disgust and Sadness - conflict on how best to navigate a new city, house, and school."
212,Barfi!,Three young people learn that love can neither be defined nor contained by society's definition of normal and abnormal.
213,12 Years a Slave,"In the antebellum United States, Solomon Northup, a free black man from upstate New York, is abducted and sold into slavery."
214,Rush,The merciless 1970s rivalry between Formula One rivals James Hunt and Niki Lauda.
215,Ford v. Ferrari,American car designer Carroll Shelby and driver Ken Miles battle corporate interference and the laws of physics to build a revolutionary race car for Ford in order to defeat Ferrari at the 24 Hours of Le Mans in 1966.
216,Spotlight,"The true story of how the Boston Globe uncovered the massive scandal of child molestation and cover-up within the local Catholic Archdiocese, shaking the entire Catholic Church to its core."
217,Song of the Sea,"Ben, a young Irish boy, and his little sister Saoirse, a girl who can turn into a seal, go on an adventure to free the fairies and save the spirit world."
218,Kahaani,"A pregnant woman's search for her missing husband takes her from London to Kolkata, but everyone she questions denies having ever met him."
219,Zindagi Na Milegi Dobara,Three friends decide to turn their fantasy vacation into reality after one of their friends gets engaged.
220,Prisoners,"When Keller Dover's daughter and her friend go missing, he takes matters into his own hands as the police pursue multiple leads and the pressure mounts."
221,Mad Max: Fury Road,"In a post-apocalyptic wasteland, a woman rebels against a tyrannical ruler in search for her homeland with the aid of a group of female prisoners, a psychotic worshiper, and a drifter named Max."
222,A Wednesday,A retiring police officer reminisces about the most astounding day of his career. About a case that was never filed but continues to haunt him in his memories - the case of a man and a Wednesday.
223,Gran Torino,"Disgruntled Korean War veteran Walt Kowalski sets out to reform his neighbor, Thao Lor, a Hmong teenager who tried to steal Kowalski's prized possession: a 1972 Gran Torino."
224,Harry Potter and the Deathly Hallows: Part 2,"Harry, Ron, and Hermione search for Voldemort's remaining Horcruxes in their effort to destroy the Dark Lord as the final battle rages on at Hogwarts."
225,Okuribito,A newly unemployed cellist takes a job preparing the dead for funerals.
226,Hachi: A Dog's Tale,A college professor bonds with an abandoned dog he takes into his home.
227,Mary and Max,"A tale of friendship between two unlikely pen pals: Mary, a lonely, eight-year-old girl living in the suburbs of Melbourne, and Max, a forty-four-year old, severely obese man living in New York."
228,How to Train Your Dragon,"A hapless young Viking who aspires to hunt dragons becomes the unlikely friend of a young dragon himself, and learns there may be more to the creatures than he assumed."
229,Tropa de Elite,"In 1997 Rio de Janeiro, Captain Nascimento has to find a substitute for his position while trying to take down drug dealers and criminals before the Pope visits."
230,Into the Wild,"After graduating from Emory University, top student and athlete Christopher McCandless abandons his possessions, gives his entire $24,000 savings account to charity and hitchhikes to Alaska to live in the wilderness. Along the way, Christopher encounters a series of characters that shape his life."
231,No Country for Old Men,Violence and mayhem ensue after a hunter stumbles upon a drug deal gone wrong and more than two million dollars in cash near the Rio Grande.
232,Lage Raho Munna Bhai,Munna Bhai embarks on a journey with Mahatma Gandhi in order to fight against a corrupt property dealer.
233,Million Dollar Baby,A determined woman works with a hardened boxing trainer to become a professional.
234,Hotel Rwanda,"Paul Rusesabagina, a hotel manager, houses over a thousand Tutsi refugees during their struggle against the Hutu militia in Rwanda, Africa."
235,Taegukgi hwinalrimyeo,"When two brothers are forced to fight in the Korean War, the elder decides to take the riskiest missions if it will help shield the younger from battle."
236,Munna Bhai M.B.B.S.,A gangster sets out to fulfill his father's dream of becoming a doctor.
237,Salinui chueok,"In a small Korean province in 1986, two detectives struggle with the case of multiple young women being found raped and murdered by an unknown culprit."
238,Dil Chahta Hai,"Three inseparable childhood friends are just out of college. Nothing comes between them - until they each fall in love, and their wildly different approaches to relationships creates tension."
239,Kill Bill: Vol. 1,"After awakening from a four-year coma, a former assassin wreaks vengeance on the team of assassins who betrayed her."
240,Finding Nemo,"After his son is captured in the Great Barrier Reef and taken to Sydney, a timid clownfish sets out on a journey to bring him home."
241,Catch Me If You Can,"A seasoned FBI agent pursues Frank Abagnale Jr. who, before his 19th birthday, successfully forged millions of dollars' worth of checks while posing as a Pan Am pilot, a doctor, and a legal prosecutor."
242,Amores perros,"A horrific car accident connects three stories, each involving characters dealing with loss, regret, and life's harsh realities, all in the name of love."
243,"Shin seiki Evangelion Gekijô-ban: Air/Magokoro wo, kimi ni",Concurrent theatrical ending of the TV series Shin Seiki Evangelion (1995).
244,Lagaan: Once Upon a Time in India,The people of a small village in Victorian India stake their future on a game of cricket against their ruthless British rulers.
245,The Sixth Sense,A boy who communicates with spirits seeks the help of a disheartened child psychologist.
246,La leggenda del pianista sull'oceano,"A baby boy, discovered in 1900 on an ocean liner, grows into a musical prodigy, never setting foot on land."
247,The Truman Show,An insurance salesman discovers his whole life is actually a reality TV show.
248,"Crna macka, beli macor",Matko and his son Zare live on the banks of the Danube river and get by through hustling and basically doing anything to make a living. In order to pay off a business debt Matko agrees to marry off Zare to the sister of a local gangster.
249,The Big Lebowski,"Jeff ""The Dude"" Lebowski, mistaken for a millionaire of the same name, seeks restitution for his ruined rug and enlists his bowling buddies to help get it."
